tweet.data.frame,match_exclamation,match_qmark,match_profanity,text_cleaned
Michigan latest state to approve autonomous vehicle testing? For more details: http://t.co/UvruMVJ5gZ,FALSE,TRUE,FALSE,Michigan latest state to approve autonomous vehicle testing For more details 
Michigan gives green light to autonomous vehicle testing despite concerns from Google: Michigan will soon become... http://t.co/4zstgYqjJn,FALSE,TRUE,FALSE,Michigan gives green light to autonomous vehicle testing despite concerns from Google Michigan will soon become 
Ford shows off its new autonomous driving research vehicle Ì¢‰âÂ‰ÛÏ itÌ¢‰âÂ‰ã¢s got lasers http://t.co/EedDkjAIMO,FALSE,TRUE,FALSE,Ford shows off its new autonomous driving research vehicle  its got lasers 
Autonomous Surface Vehicle automates engineeringÌ¢‰âÂ‰ã¢s dirtiest jobs http://t.co/QuBHED3QH9,FALSE,TRUE,FALSE,Autonomous Surface Vehicle automates engineerings dirtiest jobs 
"Driving in 280 traffic last night I fought the urge to cut off a Google autonomous vehicle. Just to help with their testing, of course.",FALSE,TRUE,FALSE,Driving in  traffic last night I fought the urge to cut off a Google autonomous vehicle Just to help with their testing of course 
"""@google: Tune in at 1pm PT: CA Gov. Brown signs autonomous vehicle bill http://t.co/PNW2u2nP""",FALSE,TRUE,FALSE, Tune in at pm PT CA Gov Brown signs autonomous vehicle bill 
"30 years ago Knight Rider premiered, and the autonomous vehicle of the future was a Trans Am. Now it's a Prius.",FALSE,TRUE,FALSE, years ago Knight Rider premiered and the autonomous vehicle of the future was a Trans Am Now it's a Prius 
If my autonomous vehicle has a drivers license without a photo... which states can it vote in? #autonomousVehicleProblems,FALSE,TRUE,FALSE,If my autonomous vehicle has a drivers license without a photo which states can it vote in autonomousVehicleProblems 
Governor Snyder announced the signing of the autonomous vehicle bill at the denso booth. http://t.co/chzKy0FGWX,FALSE,TRUE,FALSE,Governor Snyder announced the signing of the autonomous vehicle bill at the denso booth 
BYD and Singapore Institute collaborate on autonomous electric vehicle tech for mass transportation - http://t.co/Sz9km6ttYZ,FALSE,TRUE,FALSE,BYD and Singapore Institute collaborate on autonomous electric vehicle tech for mass transportation  
@uptownmaker @sparkfun any date for Autonomous Vehicle Challenge 2014?,FALSE,TRUE,FALSE,any date for Autonomous Vehicle Challenge  
autonomous road vehicle (ARVs)  http://t.co/CcjL6xs57z,FALSE,TRUE,FALSE,autonomous road vehicle ARVs  
The start to building an #autonomous RC vehicle has begun. Brought a #RaspberryPi and a monster truck RC vehicle. Let #science be DONE!!!,TRUE,TRUE,FALSE,The start to building an autonomous RC vehicle has begun Brought a RaspberryPi and a monster truck RC vehicle Let science be DONE 
Day 2 of National Association of Motor Vehicle Boards/Commissions. Full agenda...looking forward to hearing about autonomous vehicle regs.,FALSE,TRUE,FALSE,Day  of National Association of Motor Vehicle BoardsCommissions Full agendalooking forward to hearing about autonomous vehicle regs 
Can we install cameras to study Michigan football too plz? MT @NathanBomey MI will install cameras in freeways for autonomous vehicle study,FALSE,TRUE,FALSE,Can we install cameras to study Michigan football too plz MT MI will install cameras in freeways for autonomous vehicle study 
"State, GM, Ford and U-M team up to promote autonomous vehicle research: Southeast Michigan will lead the nation... http://t.co/iMhfsmGkOU",FALSE,TRUE,FALSE,State GM Ford and UM team up to promote autonomous vehicle research Southeast Michigan will lead the nation 
Verizon CEO: Autonomous Vehicle Could Happen In 3-5 Years: By Edward CardenasDETROIT (CBS Detroit) Ì¢‰âÂ‰ÛÏ The CEO of... http://t.co/utkPVlNliT,FALSE,TRUE,FALSE,Verizon CEO Autonomous Vehicle Could Happen In  Years By Edward CardenasDETROIT CBS Detroit  The CEO of 
#cpcu14 #PLIG  @BernardSoriano Tomorrow Today: Bernard Soriano is on stage now. CA is the leader in autonomous vehicle laws,FALSE,TRUE,FALSE,cpcu PLIG  Tomorrow Today Bernard Soriano is on stage now CA is the leader in autonomous vehicle laws 
Hardware for autonomous driving vehicle now is size of iPad vs filling a trunk  -- @audi #CMO #nymarketing,FALSE,TRUE,FALSE,Hardware for autonomous driving vehicle now is size of iPad vs filling a trunk   CMO nymarketing 
"If there are going to be automated cars out on the road, I want them to come from DARPA, not google",FALSE,TRUE,FALSE,If there are going to be automated cars out on the road I want them to come from DARPA not google 
Self driving cars began with DARPA in 2004. #yptbwp,FALSE,TRUE,FALSE,Self driving cars began with DARPA in  yptbwp 
"For you, @henryoddi Ì¢‰âÂÒ@TransportNation: Carnegie Mellon shows off its own driver-less car. http://t.co/WfSiq1jigj""",FALSE,TRUE,FALSE,For you  Carnegie Mellon shows off its own driverless car 
"GM Says Almost-Driverless Cars Coming By 2020: MILFORD (AP) - Sometime before the end of this decade, General... http://t.co/zFza7ybBo1",FALSE,TRUE,FALSE,GM Says AlmostDriverless Cars Coming By  MILFORD AP  Sometime before the end of this decade General 
Ì¢‰âÂÒNissan Plans to Offer Driverless Cars by 2020 http://t.co/8DYKNAX14VÌ¢‰âÂå,FALSE,TRUE,FALSE,Nissan Plans to Offer Driverless Cars by  
"GM says almost-driverless cars coming by 2020: MILFORD, Mich. Ì¢‰âÂ‰Û Sometime before the end of this decade, General... http://t.co/iLw0aeSoxH",FALSE,TRUE,FALSE,GM says almostdriverless cars coming by  MILFORD Mich  Sometime before the end of this decade General 
General Motors promises nearly driverless cars by end of decade with 'Super Cruise' system: Sometime before the... http://t.co/nyV2XCzpij,FALSE,TRUE,FALSE,General Motors promises nearly driverless cars by end of decade with 'Super Cruise' system Sometime before the 
"Ì¢‰âÂÒ@techreview: Are Driverless Cars Really Just Around the Corner? http://t.co/ceOTHNcNK5Ì¢‰âÂå &lt; Yes, and with headlights off, ready to pounce",FALSE,TRUE,FALSE, Are Driverless Cars Really Just Around the Corner lt Yes and with headlights off ready to pounce 
"Robo-cabs! Ì¢‰âÂÒ@thegooglecar: #googlecar Uber Returns the Favor, Buys 2500 Google Driverless Cars - RedOrbit http://t.co/aDqhnblIqU #TechNewsÌ¢‰âÂå",TRUE,TRUE,FALSE,Robocabs  googlecar Uber Returns the Favor Buys  Google Driverless Cars  RedOrbit TechNews 
Nissan Plans to Offer Driverless Cars by 2020 http://t.co/wllhWhQsPU,FALSE,TRUE,FALSE,Nissan Plans to Offer Driverless Cars by  
I need plan b. Outlook for cdl drivers not good thanks to Google's driverless tech. I wonder if that can handle hazmat? And FED regulations?,FALSE,TRUE,FALSE,I need plan b Outlook for cdl drivers not good thanks to Google's driverless tech I wonder if that can handle hazmat And FED regulations 
"Ì¢‰âÂÒ@ChrisHulls: Uber To Purchase 2,500 Driverless Cars From Google | TechCrunch http://t.co/ScKaMgz9QaÌ¢‰âÂå Great Service/App",FALSE,TRUE,FALSE, Uber To Purchase  Driverless Cars From Google  TechCrunch Great ServiceApp 
Uber to purchase 2500 driverless cars from Google in the future. Great investment @GoogleVentures.,FALSE,TRUE,FALSE,Uber to purchase  driverless cars from Google in the future Great investment  
@mchyser I assume the driverless cars will be able to sense other traffic through radar/sonar/etc &amp; adjust accordingly (prob faster than us),FALSE,TRUE,FALSE,I assume the driverless cars will be able to sense other traffic through radarsonaretc amp adjust accordingly prob faster than us 
Ì¢‰âÂÒ@TucsonNewsNow: Students to test driverless car http://t.co/Z5FZPw3GVOÌ¢‰âÂå @UofA  #Tucson,FALSE,TRUE,FALSE, Students to test driverless car Tucson 
There is a race 2 b first state with driverless vehicles for economic competitive edge and jobs. #ITE2013AM,FALSE,TRUE,FALSE,There is a race  b first state with driverless vehicles for economic competitive edge and jobs ITEAM 
"Uber To Purchase 2,500 Driverless Cars FromÌâåÊGoogle http://t.co/V9xYZQhAwj",FALSE,TRUE,FALSE,Uber To Purchase  Driverless Cars FromGoogle 
Dispatch from the future: Uber and driverless cars http://t.co/2p51Iypt3k via @natebessa,FALSE,TRUE,FALSE,Dispatch from the future Uber and driverless cars via  
"As a motorcyclist and technologist, IÌ¢‰âÂ‰ã¢d like to volunteer my services for testing how driverless cars deal with being trolled by motorcycles",FALSE,TRUE,FALSE,As a motorcyclist and technologist Id like to volunteer my services for testing how driverless cars deal with being trolled by motorcycles 
"Oh hai #minorityreport, @Uber is making your driverless transportation come alive...#transportation #autonomous http://t.co/p3gzq2ttFB",FALSE,TRUE,FALSE,Oh hai minorityreport is making your driverless transportation come alivetransportation autonomous 
Oh hai #minorityreport @Uber is making your driverless transportation come to life... #future #transportation http://t.co/p3gzq2ttFB,FALSE,TRUE,FALSE,Oh hai minorityreport is making your driverless transportation come to life future transportation 
"Dispatch From The Future: Uber To Purchase 2,500 Driverless Cars FromÌâåÊGoogle http://t.co/OmwDcNKBAB by @ryanlawler",FALSE,TRUE,FALSE,Dispatch From The Future Uber To Purchase  Driverless Cars FromGoogle by  
"RT @mikojava: As Google Ventures Invests $250 Million In Uber, What's Next? Driverless Cars On Demand?  http://t.co/a0ed8pVNEI via @forbes",FALSE,TRUE,FALSE,RT  As Google Ventures Invests  Million In Uber What's Next Driverless Cars On Demand  via  
TV show plot idea: big insurance exec tries to kill driverless car industry by destroying safety record using giant picture of empty road,FALSE,TRUE,FALSE,TV show plot idea big insurance exec tries to kill driverless car industry by destroying safety record using giant picture of empty road 
Driverless Google cars for Uber can we actually make this happen? ItÌ¢‰âÂ‰ã¢s 2013 and I want my flying car as well! #Jetsons,TRUE,TRUE,FALSE,Driverless Google cars for Uber can we actually make this happen Its  and I want my flying car as well Jetsons 
If @uber wants to use driverless cars that's fine. I still want to be able to rate the driver and have the bad ones fired.,FALSE,TRUE,FALSE,If wants to use driverless cars that's fine I still want to be able to rate the driver and have the bad ones fired 
@al3x or driverless car ? just have it stocked with best sellers and respond to sales via twitter or txt ?,FALSE,TRUE,FALSE,or driverless car  just have it stocked with best sellers and respond to sales via twitter or txt  
First Drive Q50 feels driverless http://usat.lie/16bZCRH @USAtoday @ChrisWoodyard @InfinitiUSA #DriveOn #tech #HighTech #Cars #Autos,FALSE,TRUE,FALSE,First Drive Q feels driverless DriveOn tech HighTech Cars Autos 
GM says almost-driverless cars coming by 2020 http://t.co/5SZmYA8Dm3 :-),FALSE,TRUE,FALSE,GM says almostdriverless cars coming by   
"last time I rode in an Uber cab the door handles were filled w/candy #humantouch ""Uber To buy 2,500 Driverless Cars http://t.co/L7T1XqoBny""",FALSE,TRUE,FALSE,last time I rode in an Uber cab the door handles were filled wcandy humantouch Uber To buy  Driverless Cars 
"Proposed effects of driverless car on all things auto--infrastructure, funding, policy-- is one of most interesting discussions right now",FALSE,TRUE,FALSE,Proposed effects of driverless car on all things autoinfrastructure funding policy is one of most interesting discussions right now 
"""@theprovince: General Motors promises nearly driverless cars by end of decade with 'Super Cruise' system http://t.co/VY8anMcZvl"" Zetson,s",FALSE,TRUE,FALSE, General Motors promises nearly driverless cars by end of decade with 'Super Cruise' system Zetsons 
GM says almost-driverless cars coming by 2020: General Motors says that before the end of this decade it will... http://t.co/69l3UCrsuK,FALSE,TRUE,FALSE,GM says almostdriverless cars coming by  General Motors says that before the end of this decade it will 
Why a driverless car? @Nissan,FALSE,TRUE,FALSE,Why a driverless car  
Thinking about Google's driverless tech and I wish I could have a bear hug...,FALSE,TRUE,FALSE,Thinking about Google's driverless tech and I wish I could have a bear hug 
@StKonrath @Which50 perhaps a future of driverless google taxis is in order for Uber?,FALSE,TRUE,FALSE,perhaps a future of driverless google taxis is in order for Uber 
Google is going to build its own driverless cars http://t.co/ICyvTJyOGF via @ForbesTech,FALSE,TRUE,FALSE,Google is going to build its own driverless cars via  
Google's driverless car + @Uber = future?,FALSE,TRUE,FALSE,Google's driverless car   future 
"@nilanp I thought the same thing actually - that there must be some strategic motive as well (e.g., driverless cars + @Uber = ?!). We'll see",TRUE,TRUE,FALSE,I thought the same thing actually  that there must be some strategic motive as well eg driverless cars    We'll see 
"RT @slashdot: Uber To Purchase 2,500 Driverless Cars From Google http://t.co/rjfkWuM9y8 &lt;- Did GOOG just out 2500 cabbies out of work?",FALSE,TRUE,FALSE,RT  Uber To Purchase  Driverless Cars From Google lt Did GOOG just out  cabbies out of work 
"@Uber is going to buy 2,500 driverless cars from @Google, proving everything Taxi Drivers have been saying about this disruptive app company",FALSE,TRUE,FALSE,is going to buy  driverless cars from  proving everything Taxi Drivers have been saying about this disruptive app company 
I guess we're going to be uber'd around in driverless cars here in SF in the not-too-distant. http://t.co/isnsh7q6WO #uber #Google,FALSE,TRUE,FALSE,I guess we're going to be uber'd around in driverless cars here in SF in the nottoodistant uber Google 
[NEW BLOG] the driverless taxi is just the beginning - http://t.co/Gefk4z35WG,FALSE,TRUE,FALSE,NEW BLOG the driverless taxi is just the beginning  
He'll carry it but he won't hit it. RT @Texashacker34 @AshleyKMayo somehow I doubt he goes driverless.,FALSE,TRUE,FALSE,He'll carry it but he won't hit it RT somehow I doubt he goes driverless 
@WalkableDFW Curious how you feel about driverless cars and the impact they'll have on cities and development.,FALSE,TRUE,FALSE,Curious how you feel about driverless cars and the impact they'll have on cities and development 
Schmidt says Google's gigabit Internet in Kansas City is more important than its driverless cars. #dbconf,FALSE,TRUE,FALSE,Schmidt says Google's gigabit Internet in Kansas City is more important than its driverless cars dbconf 
"Forget driverless cars, I'm excited to hear that Google is working on the immortality opportunity. Welcome, Ray!",TRUE,TRUE,FALSE,Forget driverless cars I'm excited to hear that Google is working on the immortality opportunity Welcome Ray 
"Eric Schmidt of Google ""takes 20 mn for human in driverless car to stop freaking out""",FALSE,TRUE,FALSE,Eric Schmidt of Google takes  mn for human in driverless car to stop freaking out 
Saw my first Google driverless car today. Not sure why the driver has her hands on the wheel though #google http://t.co/S6hqvKAt,FALSE,TRUE,FALSE,Saw my first Google driverless car today Not sure why the driver has her hands on the wheel though google 
@JustinMRaymond there will be a day that I hail a driverless car. It's name will be @HailoToronto,FALSE,TRUE,FALSE,there will be a day that I hail a driverless car It's name will be  
Is it against the law to text and drive in a driverless car @WIRED ?,FALSE,TRUE,FALSE,Is it against the law to text and drive in a driverless car  
Interesting exploration of how driverless cars might make tough ethical decisions in a crisis: http://t.co/1StjpBFjtP via @nicolasnova,FALSE,TRUE,FALSE,Interesting exploration of how driverless cars might make tough ethical decisions in a crisis via  
Larry Burns: driverless and connected vehicles can co-exist. Need fuel cells and batteries.,FALSE,TRUE,FALSE,Larry Burns driverless and connected vehicles can coexist Need fuel cells and batteries 
Driverless cars will liberate humanity by finally allowing the shift from Sing Occupancy Vehicles to Zero Occupancy Vehicles.,FALSE,TRUE,FALSE,Driverless cars will liberate humanity by finally allowing the shift from Sing Occupancy Vehicles to Zero Occupancy Vehicles 
"type faster @portemantho Ì¢‰âÂÒ@emilychangtv: ""We're not more than a few years from driverless Teslas"" -- Elon Musk on @BloombergWestÌ¢‰âÂå",FALSE,TRUE,FALSE,type faster  We're not more than a few years from driverless Teslas  Elon Musk on  
Ì¢‰âÂÒ@driverlesstrans: Tampa Bay TImes: Bottom line with #Driverless cars: Will people buy them? @susan_thurston   http://t.co/WRvJGylombÌ¢‰âÂå me!,TRUE,TRUE,FALSE, Tampa Bay TImes Bottom line with Driverless cars Will people buy them me 
#driverless cars are exciting but what to insure? Who to insure? We need system-wide reimagination of risks.. http://t.co/tqpI5CHrgj,FALSE,TRUE,FALSE,driverless cars are exciting but what to insure Who to insure We need systemwide reimagination of risks 
"""@ropomobile: Why the U.S. government wants cars to talk to each other: http://t.co/6995puC6d7 http://t.co/s8cncNPlpI via @WSJ"" #Driverless",FALSE,TRUE,FALSE, Why the US government wants cars to talk to each other via  Driverless 
Drive my car! Driverless cars could be a game changer for insurance costs @beckyyerak @bmoller  http://t.co/RKuWUhP1sw,TRUE,TRUE,FALSE,Drive my car Driverless cars could be a game changer for insurance costs 
Volvo is also making a #driverless car. Prototype NHTSA Level 3. http://t.co/JnKjwxcKMV @volvocarsglobal,FALSE,TRUE,FALSE,Volvo is also making a driverless car Prototype NHTSA Level   
Driverless Car Technology. http://t.co/cYPT7CnsSq,FALSE,TRUE,FALSE,Driverless Car Technology 
#Sensors in Driverless Cars http://t.co/3kd2n2lK63 #IoE #IoT #WSN #Tech #IntelligentTire @BMW @BMWUSA @BMWi @MEMSGroup @EHJournal @IDTechEx,FALSE,TRUE,FALSE,Sensors in Driverless Cars IoE IoT WSN Tech IntelligentTire  
@zain90909 @drvrls I agree but it seems to me that much work needs to be done to our infrastructure before driverless cars are the norm.,FALSE,TRUE,FALSE,I agree but it seems to me that much work needs to be done to our infrastructure before driverless cars are the norm 
Could #AnnArbor be the hub of wireless and driverless cars? @SEMStartup explores the future of cars and #Michigan http://t.co/fd1GaTFJ6e,FALSE,TRUE,FALSE,Could AnnArbor be the hub of wireless and driverless cars explores the future of cars and Michigan 
"I predict Google will buy Uber and create driverless transit with little self-serve bars and resurrect the ""Automat.""",FALSE,TRUE,FALSE,I predict Google will buy Uber and create driverless transit with little selfserve bars and resurrect the Automat 
Rumor is that the E.U. agreed to CityMobil2 #driverless car public demonstration projects in several cities. http://t.co/QewjJIEDZ2,FALSE,TRUE,FALSE,Rumor is that the EU agreed to CityMobil driverless car public demonstration projects in several cities 
Check out the google driverless car! http://t.co/VSPeZ5n47u,TRUE,TRUE,FALSE,Check out the google driverless car 
Ì¢‰âÂÒ@MotherJones: Chart of the Day: Driverless Cars Are Coming! http://t.co/1P59f2olRcÌ¢‰âÂå YES!!,TRUE,TRUE,FALSE, Chart of the Day Driverless Cars Are Coming YES 
@SebastianThrun talking about driverless cars and #moocs #ccideas http://t.co/NZgO3PCZIg,FALSE,TRUE,FALSE,talking about driverless cars and moocs ccideas 
Ì¢‰âÂÒ@Inc1alex: #BMWBobsled : Why driverless cars are better drivers than humans. Do you agree? http://t.co/w753nQLdgGÌ¢‰âÂå AGREE!!,TRUE,TRUE,FALSE, BMWBobsled  Why driverless cars are better drivers than humans Do you agree AGREE 
Just thinkin' O and his people will be first to buy the driverless car. #tcot,FALSE,TRUE,FALSE,Just thinkin' O and his people will be first to buy the driverless car tcot 
interesting discussion on driverless car Ì¢‰âÂÒ@robotenomics: Your questions answered: driverless cars - http://t.co/ExfytJVlIw #GoogleAlertsÌ¢‰âÂå,FALSE,TRUE,FALSE,interesting discussion on driverless car  Your questions answered driverless cars  GoogleAlerts 
@iowahawkblog @ConserAnimal   can anyone think of a metaphor for the driverless car?!,TRUE,TRUE,FALSE,can anyone think of a metaphor for the driverless car 
@TrooperBen Who gets the ticket if I crash into one of those driverless cars? Oomph,FALSE,TRUE,FALSE,Who gets the ticket if I crash into one of those driverless cars Oomph 
@toyota when is toyota going to make a driverless car?,FALSE,TRUE,FALSE,when is toyota going to make a driverless car 
Auburn Hills supplier's driverless car set to hit Nevada roads: Continental of Auburn Hills today became the first... http://t.co/7hs0LEBf,FALSE,TRUE,FALSE,Auburn Hills supplier's driverless car set to hit Nevada roads Continental of Auburn Hills today became the first 
"No driverless cars in #yeg yet. We've removed winter driving skills, situational awareness, and patience Ì¢‰âÂå_ just not the actual driver.",FALSE,TRUE,FALSE,No driverless cars in yeg yet We've removed winter driving skills situational awareness and patience  just not the actual driver 
@matjnewton Feel free to email me your thoughts on driverless cars. I may do a followup article. My email is in my Twitter bio. Cheers!,TRUE,TRUE,FALSE,Feel free to email me your thoughts on driverless cars I may do a followup article My email is in my Twitter bio Cheers 
Ì¢‰âÂèÏConnected-vehicle technologyÌ¢‰âÂ‰ã¢ could cut crashes while paving way for driverless cars http://t.co/sAms2HjMCS,FALSE,TRUE,FALSE,Connectedvehicle technology could cut crashes while paving way for driverless cars 
The computer that drives a robotic driverless car. http://t.co/bl0skRVOMQ,FALSE,TRUE,FALSE,The computer that drives a robotic driverless car 
What's up with Taxi / Uber drivers facebooking while driving. It was bad enough they can't drive without GPS. The driverless car is here.,FALSE,TRUE,FALSE,What's up with Taxi  Uber drivers facebooking while driving It was bad enough they can't drive without GPS The driverless car is here 
Driver-less cars? Come on Michigan!,TRUE,TRUE,FALSE,Driverless cars Come on Michigan 
@LazyAhab how about software updates for connected cars -- hackers -- driverless vehicles we can send on errands. So much good/bad potential,FALSE,TRUE,FALSE,how about software updates for connected cars  hackers  driverless vehicles we can send on errands So much goodbad potential 
Broad layer. Driverless car to SaaS @micahjay1 ecommerce is cold now. Need to see the product. Deck is not enough. For seed round.,FALSE,TRUE,FALSE,Broad layer Driverless car to SaaS ecommerce is cold now Need to see the product Deck is not enough For seed round 
Ì¢‰âÂÒ@AMobilityP: Larry Burns @UMEngineering we will be replacing cars w/shared driverless vehicles. #bcv2014Ì¢‰âÂå that's the Upshift vision too!,TRUE,TRUE,FALSE, Larry Burns we will be replacing cars wshared driverless vehicles bcv that's the Upshift vision too 
@Dezeen: Driverless cars designed for use as mobile offices: http://t.co/WaChy4Q7l6 #design #technology http://t.co/IZielJcbnt @transitbear,FALSE,TRUE,FALSE, Driverless cars designed for use as mobile offices design technology  
"It was born out of the discussion about driverless cars and the crazy differential equations involved in tracking road conditions, obviously",FALSE,TRUE,FALSE,It was born out of the discussion about driverless cars and the crazy differential equations involved in tracking road conditions obviously 
@TreeHugger well as long as they are in Google driver-less cars,FALSE,TRUE,FALSE,well as long as they are in Google driverless cars 
News I wrote; Technology memo: The advent of driverless cars is here amid challenges.,FALSE,TRUE,FALSE,News I wrote Technology memo The advent of driverless cars is here amid challenges 
"@jwisser @jakepolo What, with the driverless cars? ThatÌ¢‰âÂ‰ã¢ll be a standard Tesla feature within a decade.",FALSE,TRUE,FALSE,What with the driverless cars Thatll be a standard Tesla feature within a decade 
"Bad programmer, no donut for you. Ì¢‰âÂÒ@slashdot: How Do You Give a Ticket To a Driverless Car? http://t.co/9xjMitdqÌ¢‰âÂå",FALSE,TRUE,FALSE,Bad programmer no donut for you  How Do You Give a Ticket To a Driverless Car 
RT @WeirdReport: CA cancels driverless cars on state hwys as the cars were driving to TX and TN in search of a better life.,FALSE,TRUE,FALSE,RT  CA cancels driverless cars on state hwys as the cars were driving to TX and TN in search of a better life 
Fasten Your Seatbelts: GoogleÌ¢‰âÂ‰ã¢s Driverless Car Is Worth Trillions  http://t.co/vUJ7eya8,FALSE,TRUE,FALSE,Fasten Your Seatbelts Googles Driverless Car Is Worth Trillions  
@Cps235 around in a driverless car?,FALSE,TRUE,FALSE,around in a driverless car 
"New positioning tech works indoors, and underground. Think of what it could do for robotics and driverless cars http://t.co/izww1NYt",FALSE,TRUE,FALSE,New positioning tech works indoors and underground Think of what it could do for robotics and driverless cars 
This analyst just told us that the manufacturers think that driverless cars will be commercially viable before Eliza can drive. #2013CES,FALSE,TRUE,FALSE,This analyst just told us that the manufacturers think that driverless cars will be commercially viable before Eliza can drive CES 
Where can we find technical information about Google Driverless Car?,FALSE,TRUE,FALSE,Where can we find technical information about Google Driverless Car 
