tweet.data.frame,match_exclamation,match_qmark,match_profanity,text_cleaned
@LaMonicaBuzz it looks like $GOOG is really serious about making the driverless car. 500M is nothing to sneeze at!,TRUE,TRUE,FALSE,it looks like GOOG is really serious about making the driverless car M is nothing to sneeze at 
"@LisaKtanah @comingchaos A police car, several, have driven by the driverless truck with its motor (or something) running through night.",FALSE,TRUE,FALSE,A police car several have driven by the driverless truck with its motor or something running through night 
"Google jumps into the top ten patent recipients Ì¢‰âÂ‰ÛÏ powered by wearables, robots and driverless cars: Google pushed... http://t.co/9geUIePbUY",FALSE,TRUE,FALSE,Google jumps into the top ten patent recipients  powered by wearables robots and driverless cars Google pushed 
@driverlesstrans @nationaljournal Uber will go driverless.,FALSE,TRUE,FALSE,Uber will go driverless 
"@erikbryn Tampa fl has a driverless interstate currently being constructed will tie to atl, if does not apply. ? How did gov it pass voters",FALSE,TRUE,FALSE,Tampa fl has a driverless interstate currently being constructed will tie to atl if does not apply  How did gov it pass voters 
This company is claiming that it will upfit your car to driverless starting next year.   http://t.co/L1nMJTtyHS,FALSE,TRUE,FALSE,This company is claiming that it will upfit your car to driverless starting next year   
Inhabitat: Michigan is Building a Fake 30-Acre City to Test Driverless Cars. http://t.co/GPBb9IZXko,FALSE,TRUE,FALSE,Inhabitat Michigan is Building a Fake Acre City to Test Driverless Cars 
"Driverless tech: First comes carriage ... then the law: Gary Anglebrandt - Although a few states, Michigan... http://t.co/BXcMEh9m7M",FALSE,TRUE,FALSE,Driverless tech First comes carriage  then the law Gary Anglebrandt  Although a few states Michigan 
Do you think driver-less cars are the future of transportation? http://t.co/rEfPO5gKxn,FALSE,TRUE,FALSE,Do you think driverless cars are the future of transportation 
"She has no problem with officer-less ticketing, but breaks a driver-less car... http://t.co/z9j1VwR4b2",FALSE,TRUE,FALSE,She has no problem with officerless ticketing but breaks a driverless car 
Driverless #cab #nyc @ Brooklyn Bridge http://t.co/zyJxrMfWmH,FALSE,TRUE,FALSE,Driverless cab nyc  Brooklyn Bridge 
"Cruise Automation Driverless Cars For $10,000? This Startup Is Challenging GoogleÌâåÊWith A Simple Sensor  http://t.co/h63vPuvxlh via @forbes",FALSE,TRUE,FALSE,Cruise Automation Driverless Cars For  This Startup Is Challenging GoogleWith A Simple Sensor  via  
Ride sharing is eating taxi industry for lunch. Drivers jumping ship. Course wont be long before @Uber @lyft etc. operate driverless fleets.,FALSE,TRUE,FALSE,Ride sharing is eating taxi industry for lunch Drivers jumping ship Course wont be long before etc operate driverless fleets 
"""@Forbes: This startup is challenging Google's driverless car with a simple sensor: http://t.co/etQW0YHmZk http://t.co/zSX0W0gh6d"" kinect...",FALSE,TRUE,FALSE, This startup is challenging Google's driverless car with a simple sensor kinect 
@thedigitwitch This startup is challenging Google's driverless car with a simple sensor: http://t.co/jBPPXlS5un http://t.co/ZRl8SgOgE6Ì¢‰âÂå,FALSE,TRUE,FALSE,This startup is challenging Google's driverless car with a simple sensor 
Mercedes Driverless Car: http://t.co/Ed44f8I7ek,FALSE,TRUE,FALSE,Mercedes Driverless Car 
Driverless cars!! #ilovenuitblanche #snbto #toronto #lovenuitblanch lovetoronto #art #kiaÌ¢‰âÂå_ http://t.co/BL9PMNf8Wd,TRUE,TRUE,FALSE,Driverless cars ilovenuitblanche snbto toronto lovenuitblanch lovetoronto art kia 
"Crash Cars: 2 driverless cars loop at constant speed, threatening to collide. #snbto  #toronto @Ì¢‰âÂå_ http://t.co/ApljWNh1Nr",FALSE,TRUE,FALSE,Crash Cars  driverless cars loop at constant speed threatening to collide snbto  toronto  
Driverless cars driving by themselves... Can you imagine it? So insane Ì¡üèÏå± http://t.co/n4qbg0XOp6,FALSE,TRUE,FALSE,Driverless cars driving by themselves Can you imagine it So insane  
These cars driving by themselves Ì¡üèÏå± there are no actual drivers. #cars #driving #nodrivers #driverlessÌ¢‰âÂå_ http://t.co/lmNXgfMaqU,FALSE,TRUE,FALSE,These cars driving by themselves  there are no actual drivers cars driving nodrivers driverless 
Driverless car in Nathan Phillips Square #snbTO http://t.co/AIkhrfE1mL,FALSE,TRUE,FALSE,Driverless car in Nathan Phillips Square snbTO 
How much do you tip a SkyNet @uber RT @ajam: Six questions you should ask about driverless cars http://t.co/aRvoAkwRNg via @AJTechKnow,FALSE,TRUE,FALSE,How much do you tip a SkyNet RT  Six questions you should ask about driverless cars via  
Blind man drives Google driverless car. http://t.co/lxJ20sbpGD | #automotive aid |,FALSE,TRUE,FALSE,Blind man drives Google driverless car  automotive aid  
RT Ì¢‰âÂÒ@guardianeco: Driver-less #cars are coming Ì¢‰âÂ‰ÛÏ and they can see #cyclists coming too | Carlton Reid http://t.co/3gPudvPuQeÌ¢‰âÂå #safety,FALSE,TRUE,FALSE,RT  Driverless cars are coming  and they can see cyclists coming too  Carlton Reid safety 
Driverless Car forming 8pattern at Nathan Phillips square #Toronto #NuitBlanche #Scotiabank #SNBTOÌ¢‰âÂå_ http://t.co/4VqAZelSEt,FALSE,TRUE,FALSE,Driverless Car forming pattern at Nathan Phillips square Toronto NuitBlanche Scotiabank SNBTO 
"Wireless skins, accident proof trains and driverless cars: Hitachi CTO Hu Yoshida http://t.co/mQm5MhIP7a by @srikrp #bigdata via @iweekindia",FALSE,TRUE,FALSE,Wireless skins accident proof trains and driverless cars Hitachi CTO Hu Yoshida by bigdata via  
"""If I can take a ride in a driverless car on a public street, theb I see no reason why my building can't wiggle a little"" G.Lynn #archwhims",FALSE,TRUE,FALSE,If I can take a ride in a driverless car on a public street theb I see no reason why my building can't wiggle a little GLynn archwhims 
DeSoto Cab Announces the First Driverless Taxi. https://t.co/GWIIRMiDsN,FALSE,TRUE,FALSE,DeSoto Cab Announces the First Driverless Taxi httpstcoGWIIRMiDsN 
It's 2013. I can own a driver-less car but I still can't edit a tweet.,FALSE,TRUE,FALSE,It's  I can own a driverless car but I still can't edit a tweet 
DMV Hosts NorCal Workshop To Create Rules For Driverless Cars: SAN JOSE (CBS/AP) Ì¢‰âÂ‰Û With auto officials saying... http://t.co/NsAba7thQ3,FALSE,TRUE,FALSE,DMV Hosts NorCal Workshop To Create Rules For Driverless Cars SAN JOSE CBSAP  With auto officials saying 
"""Imagine if the zip car drove to you"" -- Information Technology and Innovation Foundation president on the reality of driverless cars.",FALSE,TRUE,FALSE,Imagine if the zip car drove to you  Information Technology and Innovation Foundation president on the reality of driverless cars 
Has the time finally come for the driverless car? http://t.co/usfJUC89St,FALSE,TRUE,FALSE,Has the time finally come for the driverless car 
"""Driverless cars."" - Bill #RidingRoughlyWest",FALSE,TRUE,FALSE,Driverless cars  Bill RidingRoughlyWest 
Driverless-car bill aims to smooth technology fast lane: Dustin Walsh - The Michigan Legislature isn't taking a... http://t.co/evdYFWsxGL,FALSE,TRUE,FALSE,Driverlesscar bill aims to smooth technology fast lane Dustin Walsh  The Michigan Legislature isn't taking a 
"@andrewtrevjones @MikeSoron iÌ¢‰âÂ‰ã¢m not sure. I think it would defeat the perception of driverless cars, but elec cars r pretty much just cars.",FALSE,TRUE,FALSE,im not sure I think it would defeat the perception of driverless cars but elec cars r pretty much just cars 
"@collision @id3asman those may be obsoleted actually. If everything is driverless, what's the point in ever going slower than max speed?",FALSE,TRUE,FALSE,those may be obsoleted actually If everything is driverless what's the point in ever going slower than max speed 
@anotherschwab are they picking you up with driverless cars? :-),FALSE,TRUE,FALSE,are they picking you up with driverless cars  
@KEVIN8R ha i can see that! Or driverless cars that run on sidewalks/ belt line? Thoughts #supernovasouth,TRUE,TRUE,FALSE,ha i can see that Or driverless cars that run on sidewalks belt line Thoughts supernovasouth 
"Insurance 2023 forum on the future of insurance, client communication and driverless cars! (@ Royal Ontario Museum) http://t.co/dN7qyWc6ra",TRUE,TRUE,FALSE,Insurance  forum on the future of insurance client communication and driverless cars  Royal Ontario Museum 
I wonder what programming languages Mercedes/Googles/etc are using to write the software for driverless cars.,FALSE,TRUE,FALSE,I wonder what programming languages MercedesGooglesetc are using to write the software for driverless cars 
Wondering if driverless cars will trigger totally new designs for cars in a future?,FALSE,TRUE,FALSE,Wondering if driverless cars will trigger totally new designs for cars in a future 
Will driverless cars provide disruption in the overshot car market? Less superfluous stuff to sell to a less involved ego = cheaper cars.,FALSE,TRUE,FALSE,Will driverless cars provide disruption in the overshot car market Less superfluous stuff to sell to a less involved ego  cheaper cars 
Driverless Cars and Bicycle Sculptures #nuitblance #toronto @ Nathan Phillips Square http://t.co/79nbeXaaPL,FALSE,TRUE,FALSE,Driverless Cars and Bicycle Sculptures nuitblance toronto  Nathan Phillips Square 
"Good read but ignores trucking industry ""@MfgEngNews: Driverless cars are further away than you think -@Techreview http://t.co/4buIEnycny",FALSE,TRUE,FALSE,Good read but ignores trucking industry  Driverless cars are further away than you think 
"Is this the answer d or @HillsboroughFL? ""@83DegreesMedia: Tampa Summit To Feature Driverless Cars As Transit Option http://t.co/M5XTK1zmK6""",FALSE,TRUE,FALSE,Is this the answer d or   Tampa Summit To Feature Driverless Cars As Transit Option 
@shervin was just talking about this the other night with @GregHertzke. It only makes sense that the driverless car is a Tesla.,FALSE,TRUE,FALSE,was just talking about this the other night with  It only makes sense that the driverless car is a Tesla 
Flightless drones! Ahh. Ì¢‰âÂÒ@sacbee_news: DMV seeking input of rules for driverless cars http://t.co/8im4kuuftjÌ¢‰âÂå,TRUE,TRUE,FALSE,Flightless drones Ahh  DMV seeking input of rules for driverless cars 
DMV seeking input of rules for driverless cars: Dozens attended a workshop Friday where DMV officials were... http://t.co/35s0IGwbpv,FALSE,TRUE,FALSE,DMV seeking input of rules for driverless cars Dozens attended a workshop Friday where DMV officials were 
DMV ponders how to regulate driverless cars: California must set guidelines by 2015. http://t.co/Y2PXruSG31,FALSE,TRUE,FALSE,DMV ponders how to regulate driverless cars California must set guidelines by  
@BAR_Engineer where are you going to park this driverless car? Will you be able to park this driverless car for free?,FALSE,TRUE,FALSE,where are you going to park this driverless car Will you be able to park this driverless car for free 
@BAR_Engineer are you going to drive this driverless car into manhattan? Are you going to always park for free in manhattan?,FALSE,TRUE,FALSE,are you going to drive this driverless car into manhattan Are you going to always park for free in manhattan 
@BAR_Engineer so how many of these driverless taxi can Accommodate for typical American traffic patterns w/o spaces for parking?,FALSE,TRUE,FALSE,so how many of these driverless taxi can Accommodate for typical American traffic patterns wo spaces for parking 
How will driverless cars affect our cities? http://t.co/FBh9t9FRol,FALSE,TRUE,FALSE,How will driverless cars affect our cities 
Snyder wants Michigan to approve driverless cars: Michigan Gov. Rick Snyder said Google's driverless car is... http://t.co/GpXsqTV4og,FALSE,TRUE,FALSE,Snyder wants Michigan to approve driverless cars Michigan Gov Rick Snyder said Google's driverless car is 
"@tchoi8 i'm thinking of it something like a preview of the inevitable ""asimo falls over"" video for the driverless car :)",FALSE,TRUE,FALSE,i'm thinking of it something like a preview of the inevitable asimo falls over video for the driverless car  
EspÌÄå_rito Santo State University uses #Ubuntu for developing the driverless car in Brazil  http://t.co/XPoBFnc9Xx #linux,FALSE,TRUE,FALSE,Esprito Santo State University uses Ubuntu for developing the driverless car in Brazil  linux 
@RyanNegri @shervin @kraneland @msquinn what should prevent us from watching vids in driverless cars? Cars will safer w/out us drunk/texting,FALSE,TRUE,FALSE,what should prevent us from watching vids in driverless cars Cars will safer wout us drunktexting 
@shervin @kraneland @msquinn can we at least agree on driverless uber?,FALSE,TRUE,FALSE,can we at least agree on driverless uber 
Google's driverless car has driven 500000 miles in CA already. #yptbwp,FALSE,TRUE,FALSE,Google's driverless car has driven  miles in CA already yptbwp 
@BAR_Engineer what about manhattan or should Cleveland should build spaces to temporary store your driverless car?,FALSE,TRUE,FALSE,what about manhattan or should Cleveland should build spaces to temporary store your driverless car 
@BAR_Engineer where do you park this driverless car once you reached your destination?,FALSE,TRUE,FALSE,where do you park this driverless car once you reached your destination 
"Levanowski (Google driverless car): ""In God We Trust, all others bring us data"" #energyideas http://t.co/tKtlN85PbV",FALSE,TRUE,FALSE,Levanowski Google driverless car In God We Trust all others bring us data energyideas 
"Disrupt comfort &gt;&gt; Ì¢‰âÂÒ@Computerworld: Larry Page defends Google's 'big bets' on Glass, driver-less cars http://t.co/njwvAl6PGHÌ¢‰âÂå",FALSE,TRUE,FALSE,Disrupt comfort gtgt  Larry Page defends Google's 'big bets' on Glass driverless cars 
How will driverless cars affect our cities? http://t.co/034Y7Pb0ES,FALSE,TRUE,FALSE,How will driverless cars affect our cities 
"Tech Talk tonight by Jeff Johnson: Of Driverless Cars &amp; Rosey the RobotÌ¢‰âÂå_, 5:30pm, Info East 130. Hosted by @uWIC_IUB http://t.co/hnxmwP80vh",FALSE,TRUE,FALSE,Tech Talk tonight by Jeff Johnson Of Driverless Cars amp Rosey the Robot pm Info East  Hosted by 
You mean to tell me we have driverless cars but vacums still sound like kingkong ? Why...,FALSE,TRUE,FALSE,You mean to tell me we have driverless cars but vacums still sound like kingkong  Why 
Google[x] folks now talking Driverless Cars. #kvsummit #Perseverance,FALSE,TRUE,FALSE,Googlex folks now talking Driverless Cars kvsummit Perseverance 
@KevinColahan @storybellows they said if we talk about it they'll run us over with their driverless cars,FALSE,TRUE,FALSE,they said if we talk about it they'll run us over with their driverless cars 
@billmaher they should wait until we have driverless cars,FALSE,TRUE,FALSE,they should wait until we have driverless cars 
Tesla Talks Partnering with Google for Driverless Cars: Tesla Motors is considering adding driverless technology... http://t.co/dJK3LKQyJg,FALSE,TRUE,FALSE,Tesla Talks Partnering with Google for Driverless Cars Tesla Motors is considering adding driverless technology 
Tesla talking to Google about driverless electric cars http://t.co/pwYUouRFv0 via @USATODAY,FALSE,TRUE,FALSE,Tesla talking to Google about driverless electric cars via  
"""Pardon me future... go right ahead."" http://t.co/58SakfZ9bE via @reddit #driverless #driverlesscar #google",FALSE,TRUE,FALSE,Pardon me future go right ahead via driverless driverlesscar google 
"@glen4ONT on driverless cars ""amazing"" govt's not looking seriously, risk $50B Big Move ""White Elephant"" #onpoli http://t.co/XKAYyVykTN",FALSE,TRUE,FALSE,on driverless cars amazing govt's not looking seriously risk B Big Move White Elephant onpoli 
Just saw a google driverless car!,TRUE,TRUE,FALSE,Just saw a google driverless car 
Will driverless cars eventually replace taxi drivers?,FALSE,TRUE,FALSE,Will driverless cars eventually replace taxi drivers 
Ì¢‰âÂÒ@jeffreylapin: RT @whurst1: RT @StevenMSweat: Are We Ready For Driverless Cars? - PBS NewsHour http://t.co/AK5n3djWWmÌ¢‰âÂå,FALSE,TRUE,FALSE, RT  RT  Are We Ready For Driverless Cars  PBS NewsHour 
"""Is this guy driving with his iPad?"" Google Driverless Car Punks NYC - @fffffat does it again! http://t.co/YhxPE1O57t",TRUE,TRUE,FALSE,Is this guy driving with his iPad Google Driverless Car Punks NYC  does it again 
Ì¢‰âÂÒ@StevenMSweat: Are We Ready For Driverless Cars? - PBS NewsHour http://t.co/AK5n3djWWmÌ¢‰âÂå,FALSE,TRUE,FALSE, Are We Ready For Driverless Cars  PBS NewsHour 
"Looking for a completely driverless Camry?  Sorry, but Toyota believes ""control should remain with theÌ¢‰âÂå_ http://t.co/IEVOSId7V7",FALSE,TRUE,FALSE,Looking for a completely driverless Camry  Sorry but Toyota believes control should remain with the 
"At High Speed, on the Road to a Driverless Future  http://t.co/A1zLM5Uhyd",FALSE,TRUE,FALSE,At High Speed on the Road to a Driverless Future  
"At High Speed, on the Road to a Driverless Future, via @nytimes Interesting but what if the camera's lenses get dirty http://t.co/2M71Kkwdhl",FALSE,TRUE,FALSE,At High Speed on the Road to a Driverless Future via Interesting but what if the camera's lenses get dirty 
"Me too. Ì¢‰âÂÒ@dannysullivan: ""My goal is to have Google do this before my kids start driving"" -- Susan Wojcicki on driverless cars [me too]Ì¢‰âÂå",FALSE,TRUE,FALSE,Me too  My goal is to have Google do this before my kids start driving  Susan Wojcicki on driverless cars me too 
"I drove to work today but by 2020, my car will drive me! Tune into @RJR94FM 2 find out when U can ur driverless car http://t.co/aoceqSO0MC",TRUE,TRUE,FALSE,I drove to work today but by  my car will drive me Tune into  find out when U can ur driverless car 
If you are in #SF maÌÄå±ana get educated on the commercialization of the driverless car http://t.co/2obYvzBSGQ by @parisoma. My fav @tickengo,FALSE,TRUE,FALSE,If you are in SF maana get educated on the commercialization of the driverless car by  My fav  
KTLA Consumer Confidential: Stock Market Rally; Internet Sales Tax? Driverless Technology: When not reporting for... http://t.co/6IC6a6Gkfe,FALSE,TRUE,FALSE,KTLA Consumer Confidential Stock Market Rally Internet Sales Tax Driverless Technology When not reporting for 
Tesla considers driverless cars in partnership with Google http://t.co/NZ742H9laz amazing,FALSE,TRUE,FALSE,Tesla considers driverless cars in partnership with Google amazing 
Tesla Talks Partnering with Google for Driverless Cars: Tesla Motors is considering adding driverless technology... http://t.co/pRU9AkSLI5,FALSE,TRUE,FALSE,Tesla Talks Partnering with Google for Driverless Cars Tesla Motors is considering adding driverless technology 
Ì¢‰âÂÒ@shervin: What happens to car insurance in a 100% driverless car world?Ì¢‰âÂå Time for auto insurance companies to #innovate,FALSE,TRUE,FALSE, What happens to car insurance in a  driverless car world Time for auto insurance companies to innovate 
"Once we have driverless cars, the ghost community can actively rejoin society by operating motor vehicles without causing suspicion",FALSE,TRUE,FALSE,Once we have driverless cars the ghost community can actively rejoin society by operating motor vehicles without causing suspicion 
"@JElvisWeinstein Oh, then your car must be driverless.  Those bumper stickers were right all along.",FALSE,TRUE,FALSE,Oh then your car must be driverless  Those bumper stickers were right all along 
"""@iTweetFacts: #Audi is testing their driverless car in #Tampa #Florida today. The license plate: http://t.co/IpZEtxLLp7""",FALSE,TRUE,FALSE, Audi is testing their driverless car in Tampa Florida today The license plate 
Elevated lanes of #Florida toll road close for tests of driverless cars http://t.co/H1pfQEUr9j Background http://t.co/qzana1AOPW,FALSE,TRUE,FALSE,Elevated lanes of Florida toll road close for tests of driverless cars Background 
"If we're going to have driverless cars, we should also shoot for riderless bicycles. That'll knock cyclist deaths down to nothing.",FALSE,TRUE,FALSE,If we're going to have driverless cars we should also shoot for riderless bicycles That'll knock cyclist deaths down to nothing 
.@thebolditalic #techpanel supposed to be about future of cars in &lt; 5 years. Was mostly about driverless in 15. Lots will happen before then,FALSE,TRUE,FALSE,techpanel supposed to be about future of cars in lt  years Was mostly about driverless in  Lots will happen before then 
Driverless cars will be trialled in up to three UK cities from January. http://t.co/kzz4LjFyys,FALSE,TRUE,FALSE,Driverless cars will be trialled in up to three UK cities from January 
Driverless cars get green light for testing on public roads in UK  http://t.co/Asp5me8eBU,FALSE,TRUE,FALSE,Driverless cars get green light for testing on public roads in UK  
Ì¢‰âÂÒ@EpochTimesWorld: #Britain Starting #Driverless Car Tests Next Year http://t.co/AMshlul5A5 | Epoch TimesÌ¢‰âÂå @JulieLong03 YES!!!,TRUE,TRUE,FALSE, Britain Starting Driverless Car Tests Next Year  Epoch Times YES 
"Ì¢‰âÂÒ@engadget: UK to let driverless cars loose on roads by January http://t.co/td2nYYZCZeÌ¢‰âÂå where we're going, we don't need roads #TheFuture",FALSE,TRUE,FALSE, UK to let driverless cars loose on roads by January where we're going we don't need roads TheFuture 
"""@breakingtravel: UK government announces that driverless cars will be allowed on public roads for trials..... This shouldn't be a issue smh",FALSE,TRUE,FALSE, UK government announces that driverless cars will be allowed on public roads for trials This shouldn't be a issue smh 
"Ever-vigilant DC cops pull over Google's driverless car. http://t.co/JHW7ySlf Amazingly, no one was injured. via @antderosa",FALSE,TRUE,FALSE,Evervigilant DC cops pull over Google's driverless car Amazingly no one was injured via  
"This Week In Bots: Google's Driverless Cars, Sure, But Are You Ready To Fly With A Robot Pilot? http://t.co/bQQtNgCe",FALSE,TRUE,FALSE,This Week In Bots Google's Driverless Cars Sure But Are You Ready To Fly With A Robot Pilot 
Gonna check out the driverless car (@ Googleplex - 43) http://t.co/irmdmymM,FALSE,TRUE,FALSE,Gonna check out the driverless car  Googleplex   
"Ever-vigilant DC cops pull over Google's driverless car. http://t.co/RltLZAUk Amazingly, no one was injured.",FALSE,TRUE,FALSE,Evervigilant DC cops pull over Google's driverless car Amazingly no one was injured 
The google driverless car. (at @Google) [pic] Ì¢‰âÂ‰Û http://t.co/iayxMHPn,FALSE,TRUE,FALSE,The google driverless car at  pic  
Looked like googles driver-less car but it was only this http://t.co/CuLPDb3V,FALSE,TRUE,FALSE,Looked like googles driverless car but it was only this 
"#acuhoi In 2025: driverless cars, thought controlled robotic motion, holographic sensors, virtual reality, activism...",FALSE,TRUE,FALSE,acuhoi In  driverless cars thought controlled robotic motion holographic sensors virtual reality activism 
Really thoughtful take on potential impact of driverless cars http://t.co/O0xlZLyAa4 via @trnsprttnst,FALSE,TRUE,FALSE,Really thoughtful take on potential impact of driverless cars via  
"Oh,  was it a google driverless car?",FALSE,TRUE,FALSE,Oh  was it a google driverless car 
@AdamJanofsky really I consider a subway to be a driverless car.,FALSE,TRUE,FALSE,really I consider a subway to be a driverless car 
Really now?! FBI Afraid Criminals Will Use Google's Driverless Cars For Freeway Shootouts - http://t.co/jt292Ug3fh,TRUE,TRUE,FALSE,Really now FBI Afraid Criminals Will Use Google's Driverless Cars For Freeway Shootouts  
@MarketUrbanism true. Is L driverless yet?,FALSE,TRUE,FALSE,true Is L driverless yet 
.@Google driverless car tested in #Merced. That's just the beginning #rockets #drones @KVPR  http://t.co/pAEXzblAM6 http://t.co/zSLehJQ3fe,FALSE,TRUE,FALSE,driverless car tested in Merced That's just the beginning rockets drones 
Just encountered one of these! @google driverless car. http://t.co/0Zv0L0irfR,TRUE,TRUE,FALSE,Just encountered one of these driverless car 
"@barclerk NO FUN eh?: Driverless cars are becoming reality, could be on British roads next yr http://t.co/iH7Uz2aTec http://t.co/BO2tqXHYGx",FALSE,TRUE,FALSE,NO FUN eh Driverless cars are becoming reality could be on British roads next yr 
@Audi shows off driverless car tech in Florida with @FLGovScott along for the ride. @rickscott  http://t.co/040PAjCDN2,FALSE,TRUE,FALSE,shows off driverless car tech in Florida with along for the ride 
"UK plans to allow driverless cars on public roads starting in January, what could possibly go wrong? http://t.co/2jLJqR3O8Y",FALSE,TRUE,FALSE,UK plans to allow driverless cars on public roads starting in January what could possibly go wrong 
Driverless cars to hit public roads in Britain by January 2015 http://t.co/o33bL9KcaTÌ¢‰âÂå,FALSE,TRUE,FALSE,Driverless cars to hit public roads in Britain by January  
Nissan announced in 2020 their model of the driverless car will be on the roads #thefuture,FALSE,TRUE,FALSE,Nissan announced in  their model of the driverless car will be on the roads thefuture 
Ì¢‰âÂÒA UK town is replacing its buses with driverless pods http://t.co/joC442lx0eÌ¢‰âÂåmeanwhile in FL we pay tolls2battle Disney busses to the death,FALSE,TRUE,FALSE,A UK town is replacing its buses with driverless pods in FL we pay tollsbattle Disney busses to the death 
Funny RT @loveinheadscarf: Will Saudi women be allowed to not drive a driver-less car? #Saudi #drivingban http://t.co/qFxVkZGE6k,FALSE,TRUE,FALSE,Funny RT  Will Saudi women be allowed to not drive a driverless car Saudi drivingban 
