tweet.data.frame,match_exclamation,match_qmark,match_profanity,text_cleaned
@manjulamartin @Kirk_Gleason Except trains are very capital intensive and have limited mobility. Driverless cars are the best of both worlds,FALSE,TRUE,FALSE,Except trains are very capital intensive and have limited mobility Driverless cars are the best of both worlds 
I want a Google driverless car.,FALSE,TRUE,FALSE,I want a Google driverless car 
@Oatmeal @google driverless @TeslaMotors ? Ooooh that would be awesome!!,TRUE,TRUE,FALSE,driverless  Ooooh that would be awesome 
SO MUCH AWESOME! Amazing video for GoogleÌ¢‰âÂ‰ã¢s Next Phase in Driverless Cars via @nytimes http://t.co/vo7qk0YQdP,TRUE,TRUE,FALSE,SO MUCH AWESOME Amazing video for Googles Next Phase in Driverless Cars via 
@google is making driverless cars which is awesome http://t.co/t2hW30KzcX,FALSE,TRUE,FALSE,is making driverless cars which is awesome 
"You could call a driverless car and tell the car , it will take you there.  Whoo Hoo",FALSE,TRUE,FALSE,You could call a driverless car and tell the car  it will take you there  Whoo Hoo 
"Ì¢‰âÂÒ@Marketplace: Google's driverless cars, I'll take one!!! http://t.co/SmXDPK2xZZ by @randomtape http://t.co/F33I8hpxZOÌ¢‰âÂå",TRUE,TRUE,FALSE, Google's driverless cars I'll take one by 
Driverless taxis in NYC would probably be an amazing application.  http://t.co/8JhknI2ltx,FALSE,TRUE,FALSE,Driverless taxis in NYC would probably be an amazing application  
This whole @google driverless car prototype thing is awesome. http://t.co/uGDZNxOgnu http://t.co/NaB0AkAoZN,FALSE,TRUE,FALSE,This whole driverless car prototype thing is awesome 
Google's New Driverless Car Has No Brake Pedal Or Steering Wheel http://t.co/Z2n5dEjmso via @HuffPostTech... / this is fantastic.,FALSE,TRUE,FALSE,Google's New Driverless Car Has No Brake Pedal Or Steering Wheel via   this is fantastic 
"Riding in a driverless car is on my bucket list, this is so damn exciting. #Google http://t.co/dOuKZKacnU",FALSE,TRUE,FALSE,Riding in a driverless car is on my bucket list this is so damn exciting Google 
This is the future and it is now!! OH the places we will go!! https://t.co/ypmueE0MDW Can't wait for the driverless car. #scichat,TRUE,TRUE,FALSE,This is the future and it is now OH the places we will go httpstcoypmueEMDW Can't wait for the driverless car scichat 
@NicoleLapin The driverless car is a great idea for someone like me who has an eye condition that makes me unable to drive a car.,FALSE,TRUE,FALSE,The driverless car is a great idea for someone like me who has an eye condition that makes me unable to drive a car 
This is why we need driverless cars. http://t.co/uuZ7BMHb,FALSE,TRUE,FALSE,This is why we need driverless cars 
Google developed a driverless car. Now that's fucking chill.,FALSE,TRUE,TRUE,Google developed a driverless car Now that's fucking chill 
"@WOKVNews @jax_florida @RussellANjax Can't wait for @Google driverless cars. Soon, we'll rarely drive and so many lives will be saved",FALSE,TRUE,FALSE,Can't wait for driverless cars Soon we'll rarely drive and so many lives will be saved 
They're coming out with driverless cars.... I'm in,FALSE,TRUE,FALSE,They're coming out with driverless cars I'm in 
I want a driverless car so bad.,FALSE,TRUE,FALSE,I want a driverless car so bad 
Driverless cars could also end drunk driving forever and save lives.   http://t.co/BftPWYPcE6,FALSE,TRUE,FALSE,Driverless cars could also end drunk driving forever and save lives   
"#SKYNET Ì¢‰âÂÒ@SheriJo: I am for driverless cars. Sick of the accidents, injuries, deaths, people driving recklessly all the time. It must stop.Ì¢‰âÂå",FALSE,TRUE,FALSE,SKYNET  I am for driverless cars Sick of the accidents injuries deaths people driving recklessly all the time It must stop 
"Driverless cars will eliminate 80% of traffic in crowded cities, says MIT: http://t.co/RPrdGSe8Mc",FALSE,TRUE,FALSE,Driverless cars will eliminate  of traffic in crowded cities says MIT 
Less ROAD RAGE RT @Lawsonbulk: The potential benefits of driverless cars are stunning http://t.co/opRdZkpxK4,FALSE,TRUE,FALSE,Less ROAD RAGE RT  The potential benefits of driverless cars are stunning 
Ì¢‰âÂÒ@Gezginabi: The Mercedes-Benz driverless research car looks amazing. http://t.co/a60Atju0svÌ¢‰âÂå satamadik halaa :(,FALSE,TRUE,FALSE, The MercedesBenz driverless research car looks amazing satamadik halaa  
"At a session, Watching and listening to head of googles driverless car program. Absolutely Fascinating!!",TRUE,TRUE,FALSE,At a session Watching and listening to head of googles driverless car program Absolutely Fascinating 
"Driverless Cars Sound Awesome, But The Actual Economic Impact Is Going To Blow Your Mind.   http://t.co/fqxUXYNU2Y",FALSE,TRUE,FALSE,Driverless Cars Sound Awesome But The Actual Economic Impact Is Going To Blow Your Mind   
"Can't wait for driverless cars to come out! This is the first time I'm excited about motor vehicles, in my entire life.",TRUE,TRUE,FALSE,Can't wait for driverless cars to come out This is the first time I'm excited about motor vehicles in my entire life 
"I love these times ""from age of horse less to driver less travel"" MT @forbes Google To Build Its Own Driver less Cars http://t.co/kf4Ipg0dmL",FALSE,TRUE,FALSE,I love these times from age of horse less to driver less travel MT Google To Build Its Own Driver less Cars 
13 hour drive ahead of me... @Google driverless cars can't get here fast enough,FALSE,TRUE,FALSE, hour drive ahead of me driverless cars can't get here fast enough 
Driverless cars...just think of the potential productivity &amp; safety gains. http://t.co/EVuGPeTPZB via @freakonomics,FALSE,TRUE,FALSE,Driverless carsjust think of the potential productivity amp safety gains via  
Poll: Drivers love idea of driverless cars http://t.co/WjB2qHbd86 @ChrisWoodyard @usatoday #driverless #selfdrivingcars #autonomouscar #cars,FALSE,TRUE,FALSE,Poll Drivers love idea of driverless cars driverless selfdrivingcars autonomouscar cars 
"#Google Survey just asked if I'd use a #driverless car. I only wished they had an ""Hell Yes"" as a radio selection. #cantWait #takeMyMoney",FALSE,TRUE,FALSE,Google Survey just asked if I'd use a driverless car I only wished they had an Hell Yes as a radio selection cantWait takeMyMoney 
So excited for the Google Glass and Driverless car demo just in a couple of minutes! #yglsvs,TRUE,TRUE,FALSE,So excited for the Google Glass and Driverless car demo just in a couple of minutes yglsvs 
Driverless car appeals to me instead of the real estate chauffeur one can become: http://t.co/REbLM7fYkb http://t.co/OM2Cj0n3pw,FALSE,TRUE,FALSE,Driverless car appeals to me instead of the real estate chauffeur one can become 
"Imagine a world with virtually no DUIs or massive traffic jams, and increased productivity / wealth. Driverless cars will be big for us.",FALSE,TRUE,FALSE,Imagine a world with virtually no DUIs or massive traffic jams and increased productivity  wealth Driverless cars will be big for us 
@sherylsandberg was awesome last night @Dreamforce. Seeing Google's driverless car at Stanford tonight. Is this heaven?,FALSE,TRUE,FALSE,was awesome last night  Seeing Google's driverless car at Stanford tonight Is this heaven 
Burkhard Bilger: Inside GoogleÌ¢‰âÂ‰ã¢s Driverless Car http://t.co/qQtnB4Y5pw // man I want a self driving car so badly!!,TRUE,TRUE,FALSE,Burkhard Bilger Inside Googles Driverless Car  man I want a self driving car so badly 
"@bslotterback @danalytics Yes, my 11 yo daughter says she ""can't wait"" to have her own driverless car.",FALSE,TRUE,FALSE,Yes my  yo daughter says she can't wait to have her own driverless car 
Driverless cars! Love how Google takes on big challenges AND shares insights with students @ReveAcademy http://t.co/GvIFYbWeK9,TRUE,TRUE,FALSE,Driverless cars Love how Google takes on big challenges AND shares insights with students 
Total believe it @mashable: Google's Driverless Car Is Now Safer Than the Average Driver - http://t.co/gF125DA3,FALSE,TRUE,FALSE,Total believe it  Google's Driverless Car Is Now Safer Than the Average Driver  
"I, for one, am very excited about self-driving cars. -- Google's Driverless Car is Safer than the Average Driver http://t.co/Mc5mupeU",FALSE,TRUE,FALSE,I for one am very excited about selfdriving cars  Google's Driverless Car is Safer than the Average Driver 
What a fun and exciting mental exercise to play thinking about the future of driverless cars http://t.co/XITRhk8GsH @chunkamui #killerapp,FALSE,TRUE,FALSE,What a fun and exciting mental exercise to play thinking about the future of driverless cars killerapp 
I would like to go for a drive with these guys. Driverless cars will be the safest cars ever #cas13 http://t.co/q24oKdlp,FALSE,TRUE,FALSE,I would like to go for a drive with these guys Driverless cars will be the safest cars ever cas 
@itootill @thetransitfan Driverless shared cars will be much less expensive and much safer. Will obey rules. Can't wait! 10-20 years?,TRUE,TRUE,FALSE,Driverless shared cars will be much less expensive and much safer Will obey rules Can't wait  years 
A driverless car?? I need to get me one of these http://t.co/334tLkJzuQ,FALSE,TRUE,FALSE,A driverless car I need to get me one of these 
VolvoÌ¢‰âÂ‰ã¢s New SUV Will Be Super-Safe Because ItÌ¢‰âÂ‰ã¢s Semi-Autonomous. Driverless controls by 2020. | Autopia | WIRED http://t.co/NiQab83jfU,FALSE,TRUE,FALSE,Volvos New SUV Will Be SuperSafe Because Its SemiAutonomous Driverless controls by   Autopia  WIRED 
"My first ever tweet while cruising in a #driverless car. Mindboggling, sensorial experience. Thx #Google. #whoahorsey http://t.co/iAliBTrVvt",FALSE,TRUE,FALSE,My first ever tweet while cruising in a driverless car Mindboggling sensorial experience Thx Google whoahorsey 
Amazon Prime Air almost as incredible as Google's driverless car http://t.co/SG1entwrn6,FALSE,TRUE,FALSE,Amazon Prime Air almost as incredible as Google's driverless car 
Jealous! @Reuters own @IngrassiaReuter gets to ride in  @google driverless car!!  Still ready here to beta one! http://t.co/3owbWMUu92,TRUE,TRUE,FALSE,Jealous own gets to ride in  driverless car  Still ready here to beta one 
The age of driverless cars cannot come soon enough. http://t.co/Q0Khm0EUMA,FALSE,TRUE,FALSE,The age of driverless cars cannot come soon enough 
Wow!  Driverless vehicles? Even in the streets of D.C.? http://t.co/Hi6iPEVoLL,TRUE,TRUE,FALSE,Wow  Driverless vehicles Even in the streets of DC 
Self-driving cars? Sounds good to me!  --- Headline @USATODAY: California okays driverless cars http://t.co/v9jFiX1z,TRUE,TRUE,FALSE,Selfdriving cars Sounds good to me   Headline  California okays driverless cars 
"""@nytimesbits: With a Push From Google, California Legalizes Driverless Cars http://t.co/GkQVenmb""Yeah baby! Seen cars like this here&amp;there.",TRUE,TRUE,FALSE, With a Push From Google California Legalizes Driverless Cars baby Seen cars like this hereampthere 
The future of google...driverless cars...space elevators... #mindblown,FALSE,TRUE,FALSE,The future of googledriverless carsspace elevators mindblown 
"Automotive technology: Driver-less cars will reduce accidents, ease congestion.",FALSE,TRUE,FALSE,Automotive technology Driverless cars will reduce accidents ease congestion 
So cool! RT @wired: Score! California becomes second state (after Nevada) to legalize driverless cars: http://t.co/CC69aU9b,TRUE,TRUE,FALSE,So cool RT  Score California becomes second state after Nevada to legalize driverless cars 
"I am so getting one! Hurry up KY! ""@nytimesbits: With a Push From Google, California Legalizes Driverless Cars http://t.co/NMNzaRTX""",TRUE,TRUE,FALSE,I am so getting one Hurry up KY  With a Push From Google California Legalizes Driverless Cars 
Say word you can have a driver-less car in California now... #sweet,FALSE,TRUE,FALSE,Say word you can have a driverless car in California now sweet 
"#Google 's stocks are already skyrocketing, now the driverless are approved in CA !",TRUE,TRUE,FALSE,Google 's stocks are already skyrocketing now the driverless are approved in CA  
"@wired These are to go on the google driverless cars, I hope!",TRUE,TRUE,FALSE,These are to go on the google driverless cars I hope 
I canÌ¢‰âÂ‰ã¢t wait until GoogleÌ¢‰âÂ‰ã¢s driverless cars take me on a less efficient route to my destination so as to pass by billboards deemed relevant.,FALSE,TRUE,FALSE,I cant wait until Googles driverless cars take me on a less efficient route to my destination so as to pass by billboards deemed relevant 
Google's driverless car - desperately needed in Florida!  #codecon,TRUE,TRUE,FALSE,Google's driverless car  desperately needed in Florida  codecon 
Finally Google has started making cars ! Fully integrated driver less car prototype is our there. No strafing wheel. #recode,TRUE,TRUE,FALSE,Finally Google has started making cars  Fully integrated driver less car prototype is our there No strafing wheel recode 
So...did #apple buy @beatsmusic and @beatsbydre ? Wasnt sure from the news. This other company is building driver-less cars. Way cooler.,FALSE,TRUE,FALSE,Sodid apple buy and  Wasnt sure from the news This other company is building driverless cars Way cooler 
"@hanbae @SocialShiz Sorry, I forgot all about it. Their driverless cars are cool though. #SMWF",FALSE,TRUE,FALSE,Sorry I forgot all about it Their driverless cars are cool though SMWF 
Love it@nytimes:Google's newest driverless car has no steering wheel or gas pedal and only 2 buttons: start and panic http://t.co/JadS1gSoqP,FALSE,TRUE,FALSE,Love itGoogle's newest driverless car has no steering wheel or gas pedal and only  buttons start and panic 
I'm over here writing a 2000 word essay while niggas at Google are on driverless cars making ground breaking shit. Damn. Ì¡üèÏ‰Û_,FALSE,TRUE,FALSE,I'm over here writing a  word essay while niggas at Google are on driverless cars making ground breaking shit Damn  
@grescoe Driverless cars will make buses &amp; taxis unnecessary and will solve parking issues. Kids will do more sports &amp; activities too.,FALSE,TRUE,FALSE,Driverless cars will make buses amp taxis unnecessary and will solve parking issues Kids will do more sports amp activities too 
Actually I believe that less people will be nervous seeing the Google driverless car come down the street than one with me behind the wheel.,FALSE,TRUE,FALSE,Actually I believe that less people will be nervous seeing the Google driverless car come down the street than one with me behind the wheel 
Ì¢‰âÂÒA driverless car invented by Google has completed over 300k miles and only had two accidents when humans in other cars hit itÌ¢‰âÂå It's a Prius,FALSE,TRUE,FALSE,A driverless car invented by Google has completed over k miles and only had two accidents when humans in other cars hit it It's a Prius 
The driverless revolution rolls on http://t.co/xUgoFOE2  Sent from the CNNMoney App for Android,FALSE,TRUE,FALSE,The driverless revolution rolls on  Sent from the CNNMoney App for Android 
This is why we need driverless cars. http://t.co/HSLPr873,FALSE,TRUE,FALSE,This is why we need driverless cars 
"As of August, google driverless cars have driven a total of 300000 miles with only 2 reported accidents- both the fault of the human driver.",FALSE,TRUE,FALSE,As of August google driverless cars have driven a total of  miles with only  reported accidents both the fault of the human driver 
Eliminate #caraccidents through #driverless cars and roads. #healthcare #AF4Q @ThomasFrey,FALSE,TRUE,FALSE,Eliminate caraccidents through driverless cars and roads healthcare AFQ  
"Meet Stanley, a driverless car which successfully navigated and won a 212 km off-road race @ NationalÌ¢‰âÂå_ http://t.co/piZ4KxxK0v",FALSE,TRUE,FALSE,Meet Stanley a driverless car which successfully navigated and won a  km offroad race  National 
"@edwardjolmos enjoyed your panel on Saturday, thanks for coming to Ottawa! Regarding driverless cars - thereÌ¢‰âÂ‰ã¢s hope! http://t.co/BoZZJwOXC5",TRUE,TRUE,FALSE,enjoyed your panel on Saturday thanks for coming to Ottawa Regarding driverless cars  theres hope 
.@matt_odonnell dreams of owning Mr Bean type Google driverless car. @TamEdwards6abc dreams of Matt's Bean imitation http://t.co/OK015VrZWM,FALSE,TRUE,FALSE,dreams of owning Mr Bean type Google driverless car dreams of Matt's Bean imitation 
"""We'd love to have driverless cars at @Uber...would cut out biggest cost...make rides much cheaper"" @travisk #CodeCon http://t.co/WeIKrLCSeQ",FALSE,TRUE,FALSE,We'd love to have driverless cars at would cut out biggest costmake rides much cheaper CodeCon 
"Uber's future car fleet will be driverless, cheaper: Uber Technologies Inc. envisions the future of its... http://t.co/HaflXLwrpM",FALSE,TRUE,FALSE,Uber's future car fleet will be driverless cheaper Uber Technologies Inc envisions the future of its 
Checking out the Google driverless car. I guess you would call it a smart car. SCIENCE! http://t.co/lrFZewnpQT,TRUE,TRUE,FALSE,Checking out the Google driverless car I guess you would call it a smart car SCIENCE 
Finally Google has started making cars ! Fully integrated driver less car prototype out there. No searing wheel. #recode #win,TRUE,TRUE,FALSE,Finally Google has started making cars  Fully integrated driver less car prototype out there No searing wheel recode win 
CEO on Board: Qualcomm Sees Potential in Driverless Cars: Eyesight for driverless cars. That is one market... http://t.co/ELmSkOwGcB,FALSE,TRUE,FALSE,CEO on Board Qualcomm Sees Potential in Driverless Cars Eyesight for driverless cars That is one market 
"@TheaGood Just about the time the DMV says I can no longer drive,I can still get around w a driverless car!",TRUE,TRUE,FALSE,Just about the time the DMV says I can no longer driveI can still get around w a driverless car 
"@jess sure, but @Uber will look expensive next to driverless vehicles",FALSE,TRUE,FALSE,sure but will look expensive next to driverless vehicles 
Driverless cars with no steering/breaks. Can't wait to have these as taxis. I can live with 25 mph tops in nyc http://t.co/zk7FDyker5,FALSE,TRUE,FALSE,Driverless cars with no steeringbreaks Can't wait to have these as taxis I can live with  mph tops in nyc 
@ladywhimsy @saidsecretly @nancywisser Driverless cars that go to regional rail stations are literal the best possible solution here.,FALSE,TRUE,FALSE,Driverless cars that go to regional rail stations are literal the best possible solution here 
Ì¢‰âÂÒ@TIME: Google unveils driverless car complete with no steering wheel http://t.co/4MUB5kOEVVÌ¢‰âÂå this is crazy! Watch both videos. Mind = blown,TRUE,TRUE,FALSE, Google unveils driverless car complete with no steering wheel this is crazy Watch both videos Mind  blown 
@lbauer02   Can I interest you in something in blue?  Ì¡üÁ‰ã¢Ì¡üÁ‰ÛÏÌ¡üÁ‰ÛªÌ¡üÁ‰Û÷Ì¡üÁå_Ì¡üÁå_  MT Ì¢‰âÂÒGoogle's driverless car: Good news for bad drivers http://t.co/v7hwQdbo2JÌ¢‰âÂå,FALSE,TRUE,FALSE,Can I interest you in something in blue    MT Google's driverless car Good news for bad drivers 
"#Google self driverless car has 2 buttons, no steering wheel, and no brake pedals.  Im definitely loving it.  #tech #innovation",FALSE,TRUE,FALSE,Google self driverless car has  buttons no steering wheel and no brake pedals  Im definitely loving it  tech innovation 
"@jeff_gluck based on how stupid some people drive, let's hope cars are driverless very, very soon",FALSE,TRUE,FALSE,based on how stupid some people drive let's hope cars are driverless very very soon 
Google's driverless car is dope,FALSE,TRUE,FALSE,Google's driverless car is dope 
"@cityslikr: Yes ""still cars"", BUT combine a Driverless cars with @HailoToronto tech &amp; Little PARKING needed. #TOPoli. http://t.co/1erHftO8DM",FALSE,TRUE,FALSE, Yes still cars BUT combine a Driverless cars with tech amp Little PARKING needed TOPoli 
"bullseye RT @Jason: Who loses from driverless cars? insurance companies, because no one dies or crashes!  https://t.co/LEhRPtitmf",TRUE,TRUE,FALSE,bullseye RT  Who loses from driverless cars insurance companies because no one dies or crashes  httpstcoLEhRPtitmf 
Ì¢‰âÂÒ@driverlesstrans: A trip in Google's #driverless car via @NZStuff #googlecar #futureride    http://t.co/g61btOmaBCÌ¢‰âÂå bring it soon!,TRUE,TRUE,FALSE, A trip in Google's driverless car via googlecar futureride    bring it soon 
Ì¡ü‰Û÷åÌ¢Òå¬ to the solar roadway! Pave the way to driverless cars! Can't wait! #TheFutureIsNow,TRUE,TRUE,FALSE, to the solar roadway Pave the way to driverless cars Can't wait TheFutureIsNow 
"@SmartPlanet driverless cars ARE public transportation is done right,  and Yes.",FALSE,TRUE,FALSE,driverless cars ARE public transportation is done right  and Yes 
"Cool! @obrienmedia: Good video here // Driverless Cars Are Coming, Whether We Want Them or Not http://t.co/H2QABbFhBjÌ¢‰âÂå",TRUE,TRUE,FALSE,Cool  Good video here  Driverless Cars Are Coming Whether We Want Them or Not 
"From @estimize So far Google's driverless cars have traveled 700,000 miles autonomously and only 1 accident reported. $goog",FALSE,TRUE,FALSE,From So far Google's driverless cars have traveled  miles autonomously and only  accident reported goog 
Ì¢‰âÂÒ@driverlesstrans: #Driverless future far closer than anyone dreamed via @nzherald  http://t.co/ecMAZ9strbÌ¢‰âÂå - let's hope so,FALSE,TRUE,FALSE, Driverless future far closer than anyone dreamed via  let's hope so 
"As of August 2012, Google's driverless cars have driven for over 300k miles. Only two accidents were reported during that time.",FALSE,TRUE,FALSE,As of August  Google's driverless cars have driven for over k miles Only two accidents were reported during that time 
Driverless car- Very nice! http://t.co/LhM00JEz,TRUE,TRUE,FALSE,Driverless car Very nice 
I've been obsessed about driverless cars for a while now. The Economist's September article is still worth reading http://t.co/0LR2DdqQ,FALSE,TRUE,FALSE,I've been obsessed about driverless cars for a while now The Economist's September article is still worth reading 
I can't wait for the day I can drunkenly stumble into my google driverless car and tell it to drive me to Texas.... then wake up there.,FALSE,TRUE,FALSE,I can't wait for the day I can drunkenly stumble into my google driverless car and tell it to drive me to Texas then wake up there 
"By 2035, 75% of Autos Expected to Have Driverless Tech. http://t.co/An6hrxZhSN That's fantastic cuz I'll be 61 and fighting 2 give up my car",FALSE,TRUE,FALSE,By   of Autos Expected to Have Driverless Tech That's fantastic cuz I'll be  and fighting  give up my car 
"free uber: $30 for you, $30 for me https://t.co/uuW8WjmQQo cause nyc will be safer for bikers when its full of their driverless cabs :)",FALSE,TRUE,FALSE,free uber  for you  for me httpstcouuWWjmQQo cause nyc will be safer for bikers when its full of their driverless cabs  
"Warning: #nerd tweet. I'm really excited for the Google I/O keynote. They'll probably be talking about driverless cars, wearables, and Glass",FALSE,TRUE,FALSE,Warning nerd tweet I'm really excited for the Google IO keynote They'll probably be talking about driverless cars wearables and Glass 
"Google Driverless Cars: Freedom for the Disabled?Autism is just one example - News Roseville, CA and Sacramento Metro http://t.co/JnUVWHVHJQ",FALSE,TRUE,FALSE,Google Driverless Cars Freedom for the DisabledAutism is just one example  News Roseville CA and Sacramento Metro 
My driverless cars will side swipe idiots on bicycles and stupid pedestrians.,FALSE,TRUE,FALSE,My driverless cars will side swipe idiots on bicycles and stupid pedestrians 
@DylanCC_Philly that's a smarter move. Invest in driverless cars.,FALSE,TRUE,FALSE,that's a smarter move Invest in driverless cars 
So now you can just install a box into your car and youÌâå«ll have a driverless car!? I really wanna test that thing.. http://t.co/Mwc3NaMobd,TRUE,TRUE,FALSE,So now you can just install a box into your car and youll have a driverless car I really wanna test that thing 
GOOG driverless cars and TeslaÌ¢‰âÂ‰ã¢s EV technology could combine to be the ultimate car of the future,FALSE,TRUE,FALSE,GOOG driverless cars and Teslas EV technology could combine to be the ultimate car of the future 
I think the Tracy Morgan crash may nudge acceptance toward driverless cars. I foresee highways for robot fleet vehicles in the coming years,FALSE,TRUE,FALSE,I think the Tracy Morgan crash may nudge acceptance toward driverless cars I foresee highways for robot fleet vehicles in the coming years 
Why @bre thinks driverless cars will lead to new 3D printing innovation. http://t.co/kAMhbeth7a,FALSE,TRUE,FALSE,Why thinks driverless cars will lead to new D printing innovation 
@Gizmodo 2 things...1. let's get #driverless #cars on the road first. 2. Safety a must to account for bad drivers today.,FALSE,TRUE,FALSE, things let's get driverless cars on the road first  Safety a must to account for bad drivers today 
I just saw a kid get pulled out of a Prius on a stretcher that got hit by a semi. Becoming a fan of driverless cars,FALSE,TRUE,FALSE,I just saw a kid get pulled out of a Prius on a stretcher that got hit by a semi Becoming a fan of driverless cars 
"I love that Google got tired of retrofits on existing cars and said ""fuck it! We'll build our OWN driverless cars!"" http://t.co/lXlp2D74fp",TRUE,TRUE,TRUE,I love that Google got tired of retrofits on existing cars and said fuck it We'll build our OWN driverless cars 
