tweet.data.frame,match_exclamation,match_qmark,match_profanity,text_cleaned
Driverless cars now legal in #California. I predict a dramatic increase in drive-by shootings. #UnintendedConsequences http://t.co/t9zUEOho,FALSE,TRUE,FALSE,Driverless cars now legal in California I predict a dramatic increase in driveby shootings UnintendedConsequences 
Love the picture NYTimes picked for the driverless car legalization story: Google car IN crosswalk with people in front http://t.co/NzpN4SUx,FALSE,TRUE,FALSE,Love the picture NYTimes picked for the driverless car legalization story Google car IN crosswalk with people in front 
"Driverless car rolls backwards out of parking space, crashes into pillar outside Town &amp; Country entrance. #Bainbridge http://t.co/ymcXAt3L",FALSE,TRUE,FALSE,Driverless car rolls backwards out of parking space crashes into pillar outside Town amp Country entrance Bainbridge 
Driverless robo-cars seems no fun to me / http://t.co/F4LlPLci,FALSE,TRUE,FALSE,Driverless robocars seems no fun to me  
"@vpostrel Driverless cars--great, but they aren't sustainable without an honest energy policy. Per capita energy use defines the future.",FALSE,TRUE,FALSE,Driverless carsgreat but they aren't sustainable without an honest energy policy Per capita energy use defines the future 
"@MayorGregor, $40 M/year parking revenues at risk with driverless cars. Why park for $20 when you can send the car elsewhere? Plans?",FALSE,TRUE,FALSE,  Myear parking revenues at risk with driverless cars Why park for  when you can send the car elsewhere Plans 
Driverless cars ? I think I'm about done with the world! I can't deal. GOOGLE is coming out with everything,TRUE,TRUE,FALSE,Driverless cars  I think I'm about done with the world I can't deal GOOGLE is coming out with everything 
Driverless cars... What do u think? I don't like the idea Ì¡üèÏ‰Û¢,FALSE,TRUE,FALSE,Driverless cars What do u think I don't like the idea  
Gov Brown's press conference was set in a dystopian future where billionaire cyborgs unleash armies of driverless cars: http://t.co/PfWd6eyo,FALSE,TRUE,FALSE,Gov Brown's press conference was set in a dystopian future where billionaire cyborgs unleash armies of driverless cars 
As soon as driverless cars become the norm I'll just start riding a motorcycle. #Luddite,FALSE,TRUE,FALSE,As soon as driverless cars become the norm I'll just start riding a motorcycle Luddite 
"No it won't, because I refuse to own one. @Jalopnik: A ""Driverless Car"" will be the first real robot you'll own. http://t.co/hMQXuK6n",FALSE,TRUE,FALSE,No it won't because I refuse to own one  A Driverless Car will be the first real robot you'll own 
"@maximaxoo @motherboard The driverless cars in the movie ""I robot"" more realistic.",FALSE,TRUE,FALSE,The driverless cars in the movie I robot more realistic 
This auto insurer is not happy about a future of driverless cars. http://t.co/vIET6dE0Mo http://t.co/Ah4mR0nES1Ì¢‰âÂå,FALSE,TRUE,FALSE,This auto insurer is not happy about a future of driverless cars 
"So google has a driver-less car? They can take the steering wheel away from my cold, dead hands before i buy one.",FALSE,TRUE,FALSE,So google has a driverless car They can take the steering wheel away from my cold dead hands before i buy one 
"@drgitlin yes, I just meant in the sense that people on it aren't driving. We don't need f'n driverless passenger cars.",FALSE,TRUE,FALSE,yes I just meant in the sense that people on it aren't driving We don't need f'n driverless passenger cars 
"What is this I am hearing about driverless cars coming out? Da fuck? Are people that lazy, that just seems dangerous as all hell.",FALSE,TRUE,TRUE,What is this I am hearing about driverless cars coming out Da fuck Are people that lazy that just seems dangerous as all hell 
@littleben2009 no way would I put my trust in a driverless car. That's were they would lose people.,FALSE,TRUE,FALSE,no way would I put my trust in a driverless car That's were they would lose people 
@google watched the video now that I'm home from work. WTF. I thought we were getting a driverless car not some Orwellian Big Brother shit.,FALSE,TRUE,FALSE,watched the video now that I'm home from work WTF I thought we were getting a driverless car not some Orwellian Big Brother shit 
Good. I still won't even do self check-out RT @techreview Driverless Cars Are Further Away Than You Think http://t.co/3bIsL2mK7s,FALSE,TRUE,FALSE,Good I still won't even do self checkout RT Driverless Cars Are Further Away Than You Think 
"oh hell no, i know enough about computers to not trust a driverless car",FALSE,TRUE,FALSE,oh hell no i know enough about computers to not trust a driverless car 
"""Driver-less cars could be potentially lethal"" - news ticker.   Yeah I mean I would think so too...",FALSE,TRUE,FALSE,Driverless cars could be potentially lethal  news ticker   Yeah I mean I would think so too 
Aren't they already? Ì¢‰âÂÒ@Techmeme: FBI warns driverless cars could be used as 'lethal weapons' http://t.co/BZCGGulW6x http://t.co/sTLxMt1lLzÌ¢‰âÂå,FALSE,TRUE,FALSE,Aren't they already  FBI warns driverless cars could be used as 'lethal weapons' 
"Thanks for share. Driverless cars won't make us thinner, healthier, happier Ì¢‰âÂÒ@transitfok: Driverless cars and sprawl http://t.co/q6OI1IfwLhÌ¢‰âÂå",FALSE,TRUE,FALSE,Thanks for share Driverless cars won't make us thinner healthier happier  Driverless cars and sprawl 
"Also, cars with drivers @transsafe: FBI warns driverless cars could be used as 'lethal weapons' @BerkeleyITS @tsrcits http://t.co/Qd9UrEImqq",FALSE,TRUE,FALSE,Also cars with drivers  FBI warns driverless cars could be used as 'lethal weapons' 
"They're on about driverless automated cars, why waste the money? Get a fucking taxi",FALSE,TRUE,TRUE,They're on about driverless automated cars why waste the money Get a fucking taxi 
"Driverless cars are terrible. How can anyone be a fan of them. I mean, c'mon!!!",TRUE,TRUE,FALSE,Driverless cars are terrible How can anyone be a fan of them I mean c'mon 
Driverless cars. DUMBEST F..ING Idea I have ever heard of.,FALSE,TRUE,FALSE,Driverless cars DUMBEST FING Idea I have ever heard of 
"Google driver-less car is not viable , insurance companies would have no part of it.",FALSE,TRUE,FALSE,Google driverless car is not viable  insurance companies would have no part of it 
"#Durham Driverless car causes crash in NC, two people injured - http://t.co/Oz48xG2bX4 http://t.co/sgdLDH1PJF #dur @DurhamNC_",FALSE,TRUE,FALSE,Durham Driverless car causes crash in NC two people injured  dur  
CAR WARS - Action/Sci-Fi - Drew Goddard - 'In the future driverless cars become sentient and turn on the human race'.  #blackoutlist2013,FALSE,TRUE,FALSE,CAR WARS  ActionSciFi  Drew Goddard  'In the future driverless cars become sentient and turn on the human race'  blackoutlist 
"8:28 AM - The driverless cars take us to the wrong spot. @DustyEyesSEM says, ""Damn Robots."" I agree. We board a bus. #DelucchiDoesGoogle",FALSE,TRUE,FALSE, AM  The driverless cars take us to the wrong spot says Damn Robots I agree We board a bus DelucchiDoesGoogle 
Driverless cars ? What's the point ?,FALSE,TRUE,FALSE,Driverless cars  What's the point  
Driverless cars?!! Wth!i honestly don't think that's a good idea..,TRUE,TRUE,FALSE,Driverless cars Wthi honestly don't think that's a good idea 
Google developing a driverless car??? da facckk?!,TRUE,TRUE,FALSE,Google developing a driverless car da facckk 
Driverless Cars: Now Street-Legal in California ... a good reason to leave CA... no one is behind the wheel http://t.co/1keEMOpH,FALSE,TRUE,FALSE,Driverless Cars Now StreetLegal in California  a good reason to leave CA no one is behind the wheel 
@d3signerd Ì¢‰âÂå_being systematically run over by driverless cars.,FALSE,TRUE,FALSE,being systematically run over by driverless cars 
Two places I'd invest all my money if I could: 3D printing and Self-driving cars!!!,TRUE,TRUE,FALSE,Two places I'd invest all my money if I could D printing and Selfdriving cars 
Awesome! Google driverless cars will help the blind travel more often; https://t.co/QWuXR0FrBpv,TRUE,TRUE,FALSE,Awesome Google driverless cars will help the blind travel more often httpstcoQWuXRFrBpv 
Autonomous vehicles could reduce traffic fatalities by 90%...I'm in!,TRUE,TRUE,FALSE,Autonomous vehicles could reduce traffic fatalities by I'm in 
Really good presentation from Jan Becker on Bosch's automated vehicle research. #AutoAuto check it out,FALSE,TRUE,FALSE,Really good presentation from Jan Becker on Bosch's automated vehicle research AutoAuto check it out 
Ford just revealed it's Automated Ford Fusion Hybrid Vehicle. Pretty amazing. #fordtrends @ Ford TestÌ¢‰âÂå_ http://t.co/7axya8ogIW,FALSE,TRUE,FALSE,Ford just revealed it's Automated Ford Fusion Hybrid Vehicle Pretty amazing fordtrends  Ford Test 
"So yeah, just throwing this out there again. Would totally be down to beta test an autonomous car.",FALSE,TRUE,FALSE,So yeah just throwing this out there again Would totally be down to beta test an autonomous car 
"@TeslaMotors Musk reluctant to partner with Apple, Google, but an Android controlled, autonomous smart-car would be awesome!!",TRUE,TRUE,FALSE,Musk reluctant to partner with Apple Google but an Android controlled autonomous smartcar would be awesome 
Finished SF&gt;LA drive. Now itÌ¢‰âÂ‰ã¢s LA&gt;OC in rush hour for a meeting. I canÌ¢‰âÂ‰ã¢t wait for an autonomous google car.,FALSE,TRUE,FALSE,Finished SFgtLA drive Now its LAgtOC in rush hour for a meeting I cant wait for an autonomous google car 
"The #Google autonomous car paid a visit to Nvidia HQ. Pretty cool technology, but as a person whoÌ¢‰âÂå_ http://t.co/rjQ5Td78fj",FALSE,TRUE,FALSE,The Google autonomous car paid a visit to Nvidia HQ Pretty cool technology but as a person who 
"Finally, a very realistic timeline for full autonomous car capability. Hats off, @MorganStanley #AutoForum http://t.co/ZwemgV5JF8",FALSE,TRUE,FALSE,Finally a very realistic timeline for full autonomous car capability Hats off AutoForum 
"It'll be cool when cars are fully autonomous, cause I'm totally gonna sleep while my car drives.",FALSE,TRUE,FALSE,It'll be cool when cars are fully autonomous cause I'm totally gonna sleep while my car drives 
Autonomous car driving could free up the $200 billion that's wasted in car insurance.,FALSE,TRUE,FALSE,Autonomous car driving could free up the  billion that's wasted in car insurance 
Awesome! #Google builds the first purpose-built autonomous vehicle #SelfDrivenCar http://t.co/jfU7h4xevG,TRUE,TRUE,FALSE,Awesome Google builds the first purposebuilt autonomous vehicle SelfDrivenCar 
I'm glad I have a semi-autonomous vehicle. This heavy rain was worse than driving in a blizzard! #weatherwednesday http://t.co/JiBihB12Mx,TRUE,TRUE,FALSE,I'm glad I have a semiautonomous vehicle This heavy rain was worse than driving in a blizzard weatherwednesday 
Chris Urmson (@googleresearch @CarnegieMellon) really boosted my hope for autonomous vehicle viability in the near future #RoboBusiness,FALSE,TRUE,FALSE,Chris Urmson  really boosted my hope for autonomous vehicle viability in the near future RoboBusiness 
@sherod @erikbryn drive a partially autonomous vehicle (radar cruise control) and you will be a believer. The tech is a life saver.,FALSE,TRUE,FALSE,drive a partially autonomous vehicle radar cruise control and you will be a believer The tech is a life saver 
"Jeff Owens, @DelphiAuto CTO: A fully autonomous vehicle is a moon shot for our industry. #MBS2014 http://t.co/BccKZiPnX8",FALSE,TRUE,FALSE,Jeff Owens CTO A fully autonomous vehicle is a moon shot for our industry MBS 
"Yes!!!!! MT ""@mims: Elon Musk says Tesla's fully-autonomous electric vehicle will be on the road in 5-6 years http://t.co/rAoQQP1fLV""",TRUE,TRUE,FALSE,Yes MT  Elon Musk says Tesla's fullyautonomous electric vehicle will be on the road in  years 
Dear @GoogleVentures: please hurry with the driverless cars. 'Cuz the ones driven by humans are making me CRAZY!!!,TRUE,TRUE,FALSE,Dear  please hurry with the driverless cars 'Cuz the ones driven by humans are making me CRAZY 
I wish I had a driverless car right now @thetechblock #dd,FALSE,TRUE,FALSE,I wish I had a driverless car right now dd 
@salimismail - driverless cars will save $6bn in time $2.5bn in accident costs. We will ask why we let humans drive. @GUimpact launch,FALSE,TRUE,FALSE, driverless cars will save bn in time bn in accident costs We will ask why we let humans drive launch 
http://t.co/lsyL4Qfccw  Half of Americans want to live in a smart city with driverless cars,FALSE,TRUE,FALSE, Half of Americans want to live in a smart city with driverless cars 
I hope it's sooner! Ì¢‰âÂÒ@prioritydata: A study suggests that nearly all cars are expected to be driverless by 2050. http://t.co/FfMugvFEppÌ¢‰âÂå,TRUE,TRUE,FALSE,I hope it's sooner  A study suggests that nearly all cars are expected to be driverless by  
"Ì¢‰âÂÒ@joelgascoigne: ""Fasten Your Seatbelts: Google's Driverless Car Is Worth Trillions"" http://t.co/GfwZqj0ZÌ¢‰âÂå I want it :)",FALSE,TRUE,FALSE, Fasten Your Seatbelts Google's Driverless Car Is Worth Trillions I want it  
"my dad is OBSESSED with this google driverless car. ""THIS IS HAPPENING. ARTIFICIAL INTELLIGENCE"" ""WHEN YOU'RE AN ADULT, ITS GONNA HAPPEN""",FALSE,TRUE,FALSE,my dad is OBSESSED with this google driverless car THIS IS HAPPENING ARTIFICIAL INTELLIGENCE WHEN YOU'RE AN ADULT ITS GONNA HAPPEN 
Innovation at its finest RTÌ¢‰âÂÒ@ForbesTech: Google's trillion $$ driverless car will b commercialized sooner than u think http://t.co/jQa3MIjTÌ¢‰âÂå,FALSE,TRUE,FALSE,Innovation at its finest RT Google's trillion  driverless car will b commercialized sooner than u think 
""" A driverless car invented by Google has completed over 300k miles and only had two accidents when humans in other cars hit it.""",FALSE,TRUE,FALSE, A driverless car invented by Google has completed over k miles and only had two accidents when humans in other cars hit it 
I can't wait for this to be standard. Ì¢‰âÂÒ@Forbes: Fasten your seatbelts: Google's driverless car is worth trillions http://t.co/ielHE36DÌ¢‰âÂå,FALSE,TRUE,FALSE,I can't wait for this to be standard  Fasten your seatbelts Google's driverless car is worth trillions 
This is honestly the coolest thing ever...Ì¢‰âÂÒ@Forbes: Fasten your seatbelts: Google's driverless car is worth trillions http://t.co/lTYYr1PwÌ¢‰âÂå,FALSE,TRUE,FALSE,This is honestly the coolest thing ever Fasten your seatbelts Google's driverless car is worth trillions 
saw the audi new driver less parking technology...it is really awesome,FALSE,TRUE,FALSE,saw the audi new driver less parking technologyit is really awesome 
@fawnjohnson Car accidents are the primary killer of Americans. Driverless cars will end that. We should be doing all we can to get there.,FALSE,TRUE,FALSE,Car accidents are the primary killer of Americans Driverless cars will end that We should be doing all we can to get there 
"This is cool: Swivel seats, big screen, espresso. Inside the driverless car of the future http://t.co/dFkywEtTwW http://t.co/IrHrelyajM",FALSE,TRUE,FALSE,This is cool Swivel seats big screen espresso Inside the driverless car of the future 
@AHBSradio @drvrls I would LOVE a driverless car!! #GreatIdea,TRUE,TRUE,FALSE,I would LOVE a driverless car GreatIdea 
"I'd love to see @google rethink the inside of cars now that they're #driverless, so much could change for the better! http://t.co/0dkPSjcwVa",TRUE,TRUE,FALSE,I'd love to see rethink the inside of cars now that they're driverless so much could change for the better 
"Ì¢‰âÂÒ@theanisilmi: If driverless car exists, I'll be glad to have it lol.Ì¢‰âÂå Can't come soon enough #30kperyear auto accident deaths",FALSE,TRUE,FALSE, If driverless car exists I'll be glad to have it lol Can't come soon enough kperyear auto accident deaths 
"When fully implemented, driverless vehicles could reduce accidents by 90%, saving 35k+ lives in the US each year. #transportationtomorrow",FALSE,TRUE,FALSE,When fully implemented driverless vehicles could reduce accidents by  saving k lives in the US each year transportationtomorrow 
"Yes pls! RT Ì¢‰âÂÒ@Colin_Sebastian: Google says they hope to use driverless cars for shopping delivery in a ""few years"" #droneswithoutwingsÌ¢‰âÂå",TRUE,TRUE,FALSE,Yes pls RT  Google says they hope to use driverless cars for shopping delivery in a few years droneswithoutwings 
Can we have driverless cars already.,FALSE,TRUE,FALSE,Can we have driverless cars already 
Ì¢‰âÂÒ@Forbes: It's time for the auto industry to create a new Model T http://t.co/RWgu3ymGXlÌ¢‰âÂå yes a #driverless Model T,FALSE,TRUE,FALSE, It's time for the auto industry to create a new Model T yes a driverless Model T 
Good! Now to ensure politicians don't stand in the way! Ì¢‰âÂÒGoogle says its driverless cars are ready for city streets: http://t.co/Y6g6HmsXRqÌ¢‰âÂå,TRUE,TRUE,FALSE,Good Now to ensure politicians don't stand in the way Google says its driverless cars are ready for city streets 
"@NBCLA @joemmathews I can't wait for a driverless future, soooo cooooool!",TRUE,TRUE,FALSE,I can't wait for a driverless future soooo cooooool 
Great presentation at the @UAlberta this afternoon from Sebastian Thrun on driverless cars. Really fascinating stuff.,FALSE,TRUE,FALSE,Great presentation at the this afternoon from Sebastian Thrun on driverless cars Really fascinating stuff 
Driverless cars? Cool!,TRUE,TRUE,FALSE,Driverless cars Cool 
THANK ALLAH. Can't come fast enough.  The Economist | Schumpeter: The driverless road ahead http://t.co/SUrJJGpq via @theeconomist,FALSE,TRUE,FALSE,THANK ALLAH Can't come fast enough  The Economist  Schumpeter The driverless road ahead via  
I want to sit all day at CodeCon! Driverless cars and the Skype instant translator are uber cool!  #codecon,TRUE,TRUE,FALSE,I want to sit all day at CodeCon Driverless cars and the Skype instant translator are uber cool  codecon 
Google plans on having 100 driverless cars on the road by next year. DriverLESS. Cars. So cool,FALSE,TRUE,FALSE,Google plans on having  driverless cars on the road by next year DriverLESS Cars So cool 
When can I get one? #signmeup #want #thefuture #socool Ì¡üÁ‰ÛÓ RT @HuffingtonPost: Meet Google's newest driverless car http://t.co/aUhE3jsRM0,FALSE,TRUE,FALSE,When can I get one signmeup want thefuture socool  RT  Meet Google's newest driverless car 
#Marylanddrivers RT @TonyFratto: Driverless cars can't come soon enough.,FALSE,TRUE,FALSE,Marylanddrivers RT  Driverless cars can't come soon enough 
Ì¢‰âÂÒ@alexisohanian: I'm so ready. Disruptions: How Driverless Cars Could Reshape Cities http://t.co/Osxq85KPvsÌ¢‰âÂå the future!!,TRUE,TRUE,FALSE, I'm so ready Disruptions How Driverless Cars Could Reshape Cities the future 
A driverless car invented by Google has completed over 300k miles and only had two accidents when humans in other cars hit it. GOOD MORNING!,TRUE,TRUE,FALSE,A driverless car invented by Google has completed over k miles and only had two accidents when humans in other cars hit it GOOD MORNING 
I'm sooo excited for driverless cars! http://t.co/TRZ3qx6OG6,TRUE,TRUE,FALSE,I'm sooo excited for driverless cars 
Pumped to see some driverless cars today @ejdub. This is going to be great!,TRUE,TRUE,FALSE,Pumped to see some driverless cars today  This is going to be great 
I want a driverless Robocar! Listening to @bradtem here at #ocediscovery! http://t.co/dz5nEL5lZ5,TRUE,TRUE,FALSE,I want a driverless Robocar Listening to here at ocediscovery 
@ryanchris I drive hundreds of miles a week. Bring on the driverless car. CanÌ¢‰âÂ‰ã¢t wait to stop driving.,FALSE,TRUE,FALSE,I drive hundreds of miles a week Bring on the driverless car Cant wait to stop driving 
The future! So buying one of these. Ì¢‰âÂÒ@CNET: Audi is ready to test autonomous cars on public roads http://t.co/aZTbHLcy #CES #2013CESÌ¢‰âÂå,TRUE,TRUE,FALSE,The future So buying one of these  Audi is ready to test autonomous cars on public roads CES CES 
"Audi is test driving their driverless car in Tampa today, pretty cool.",FALSE,TRUE,FALSE,Audi is test driving their driverless car in Tampa today pretty cool 
autonomous car s quite a potential business case in markets like north america as speeds for every single road is defined. even on freeways!,TRUE,TRUE,FALSE,autonomous car s quite a potential business case in markets like north america as speeds for every single road is defined even on freeways 
Nissan to have an autonomous car by the year 2020. Sign me up!,TRUE,TRUE,FALSE,Nissan to have an autonomous car by the year  Sign me up 
Huge advances in autonomous cars. Ì¢‰âÂÒ@WSJ: Hate parking? Audi unveiled a self-driving car that can park itself: http://t.co/F2tZNsiy #CESÌ¢‰âÂå,FALSE,TRUE,FALSE,Huge advances in autonomous cars  Hate parking Audi unveiled a selfdriving car that can park itself CES 
RT Ì¢‰âÂÒ@TheEricFulton: Great article on #disabled transportation I will opt 4  @elonmusk 2 deliver my #autonomous car http://t.co/2hJxhTPsQ6Ì¢‰âÂå,FALSE,TRUE,FALSE,RT  Great article on disabled transportation I will opt    deliver my autonomous car 
Volvo's Awesome New Autonomous Self-Parking Car Is Its Own Valet http://t.co/UJqyzY2mvq,FALSE,TRUE,FALSE,Volvo's Awesome New Autonomous SelfParking Car Is Its Own Valet 
In less than five years I can use the Google autonomous car. I will get on the list now,FALSE,TRUE,FALSE,In less than five years I can use the Google autonomous car I will get on the list now 
I look forward to seeing Google's self-driving car and other autonomous vehicles driving around the District http://t.co/arUY22uW9i,FALSE,TRUE,FALSE,I look forward to seeing Google's selfdriving car and other autonomous vehicles driving around the District 
Ì¢‰âÂÒTook a ride in a Google self-driving car. Lived to tell about it: http://t.co/96ROmPcv #Autonomous http://t.co/QMRtgjnEÌ¢‰âÂå @ericpwhall,FALSE,TRUE,FALSE,Took a ride in a Google selfdriving car Lived to tell about it Autonomous  
Nissan debuts first-ever fly-by-wire automobile steering system. Your autonomous car is gonna love it. http://t.co/gL#amD4Gm,FALSE,TRUE,FALSE,Nissan debuts firstever flybywire automobile steering system Your autonomous car is gonna love it 
Whoa just peeped an autonomous google car,FALSE,TRUE,FALSE,Whoa just peeped an autonomous google car 
"Very cool video of how an autonomous car works. From ""Where To?"" Opening tomorrow @ComputerHistory #chmwhereto http://t.co/amTfkZlKBS",FALSE,TRUE,FALSE,Very cool video of how an autonomous car works From Where To Opening tomorrow chmwhereto 
"Reuss says Google autonomous car looks kind of like VW and that it is ""kind of cool.""",FALSE,TRUE,FALSE,Reuss says Google autonomous car looks kind of like VW and that it is kind of cool 
Imagine a world w/o drunk driving deaths. RT @elidourado: Drunk riding in an autonomous car is safer than sober driving.,FALSE,TRUE,FALSE,Imagine a world wo drunk driving deaths RT  Drunk riding in an autonomous car is safer than sober driving 
"The ""iCar"" isn't autonomous, but it's way way more fun to drive than a Google bubble car. http://t.co/q5g7zojAEC",FALSE,TRUE,FALSE,The iCar isn't autonomous but it's way way more fun to drive than a Google bubble car 
Thx 2 @CarnegieMellon 4 bringing their #autonomous car 2 #Congress. This technology will literally drive the future. http://t.co/dZclAZWMh1,FALSE,TRUE,FALSE,Thx   bringing their autonomous car  Congress This technology will literally drive the future 
Autonomous Driving Advantage #14 - Your car can drive itself to the shop so you don't have to wait around in some smelly waiting room,FALSE,TRUE,FALSE,Autonomous Driving Advantage   Your car can drive itself to the shop so you don't have to wait around in some smelly waiting room 
"Showing video of google autonomous car -- it is very cool. 350,000 miles driven w/ no driver interaction across 10 vehicles.",FALSE,TRUE,FALSE,Showing video of google autonomous car  it is very cool  miles driven w no driver interaction across  vehicles 
"Google should buy Tesla and Uber, mix a little autonomous car into the mix and solve all transportation problems.  #sentFromTraffic",FALSE,TRUE,FALSE,Google should buy Tesla and Uber mix a little autonomous car into the mix and solve all transportation problems  sentFromTraffic 
Fascinating presentation by Chris Urmson head of #Google #autonomous #car on the hill / @ Rayburn,FALSE,TRUE,FALSE,Fascinating presentation by Chris Urmson head of Google autonomous car on the hill   Rayburn 
Drivers would opt for autonomous driving for cheaper car insurance as well http://t.co/nOap06ilWZ,FALSE,TRUE,FALSE,Drivers would opt for autonomous driving for cheaper car insurance as well 
To put it in lay terms. An autonomous nuclear powered car just landed itself on Mars using a rocket crane! This is huge!,TRUE,TRUE,FALSE,To put it in lay terms An autonomous nuclear powered car just landed itself on Mars using a rocket crane This is huge 
There's some great projects being worked on in our robotics lab like an autonomous car and lego builder. At WCCC we love a hands-on approach,FALSE,TRUE,FALSE,There's some great projects being worked on in our robotics lab like an autonomous car and lego builder At WCCC we love a handson approach 
"Last night I saw horse cops, makes me have hope for the car once silly autonomous vehicles take over the market http://t.co/craLBSS6oa",FALSE,TRUE,FALSE,Last night I saw horse cops makes me have hope for the car once silly autonomous vehicles take over the market 
